{
  "contractName": "Fee",
  "sourceName": "contracts/interfaces/Fee.sol",
  "abi": [
    {
      "inputs": [
        {
          "internalType": "uint256",
          "name": "posIndex",
          "type": "uint256"
        },
        {
          "internalType": "uint256",
          "name": "rewardAmount",
          "type": "uint256"
        }
      ],
      "name": "getCommission",
      "outputs": [
        {
          "internalType": "uint256",
          "name": "",
          "type": "uint256"
        }
      ],
      "stateMutability": "view",
      "type": "function"
    }
  ],
  "bytecode": "0x",
  "deployedBytecode": "0x",
  "linkReferences": {},
  "deployedLinkReferences": {},
  "devdoc": {
    "author": "Danilo Tuler",
    "kind": "dev",
    "methods": {
      "getCommission(uint256,uint256)": {
        "returns": {
          "_0": "amount of tokens taken by the pool owner as commission"
        }
      }
    },
    "title": "Calculator of pool owner commission for each block reward",
    "version": 1
  },
  "evm": {
    "bytecode": {
      "functionDebugData": {},
      "generatedSources": [],
      "linkReferences": {},
      "object": "",
      "opcodes": "",
      "sourceMap": ""
    },
    "deployedBytecode": {
      "functionDebugData": {},
      "generatedSources": [],
      "immutableReferences": {},
      "linkReferences": {},
      "object": "",
      "opcodes": "",
      "sourceMap": ""
    },
    "gasEstimates": null,
    "methodIdentifiers": {
      "getCommission(uint256,uint256)": "b1fc8ad4"
    }
  },
  "metadata": "{\"compiler\":{\"version\":\"0.8.7+commit.e28d00a7\"},\"language\":\"Solidity\",\"output\":{\"abi\":[{\"inputs\":[{\"internalType\":\"uint256\",\"name\":\"posIndex\",\"type\":\"uint256\"},{\"internalType\":\"uint256\",\"name\":\"rewardAmount\",\"type\":\"uint256\"}],\"name\":\"getCommission\",\"outputs\":[{\"internalType\":\"uint256\",\"name\":\"\",\"type\":\"uint256\"}],\"stateMutability\":\"view\",\"type\":\"function\"}],\"devdoc\":{\"author\":\"Danilo Tuler\",\"kind\":\"dev\",\"methods\":{\"getCommission(uint256,uint256)\":{\"returns\":{\"_0\":\"amount of tokens taken by the pool owner as commission\"}}},\"title\":\"Calculator of pool owner commission for each block reward\",\"version\":1},\"userdoc\":{\"kind\":\"user\",\"methods\":{\"getCommission(uint256,uint256)\":{\"notice\":\"calculates the total amount of the reward that will be directed to the pool owner\"}},\"notice\":\"This provides flexibility for different commission models\",\"version\":1}},\"settings\":{\"compilationTarget\":{\"contracts/interfaces/Fee.sol\":\"Fee\"},\"evmVersion\":\"london\",\"libraries\":{},\"metadata\":{\"bytecodeHash\":\"ipfs\",\"useLiteralContent\":true},\"optimizer\":{\"enabled\":true,\"runs\":200},\"remappings\":[]},\"sources\":{\"contracts/interfaces/Fee.sol\":{\"content\":\"// Copyright 2021 Cartesi Pte. Ltd.\\n\\n// SPDX-License-Identifier: Apache-2.0\\n// Licensed under the Apache License, Version 2.0 (the \\\"License\\\"); you may not use\\n// this file except in compliance with the License. You may obtain a copy of the\\n// License at http://www.apache.org/licenses/LICENSE-2.0\\n\\n// Unless required by applicable law or agreed to in writing, software distributed\\n// under the License is distributed on an \\\"AS IS\\\" BASIS, WITHOUT WARRANTIES OR\\n// CONDITIONS OF ANY KIND, either express or implied. See the License for the\\n// specific language governing permissions and limitations under the License.\\n\\npragma solidity >=0.7.0 <0.9.0;\\n\\n/// @title Calculator of pool owner commission for each block reward\\n/// @author Danilo Tuler\\n/// @notice This provides flexibility for different commission models\\ninterface Fee {\\n    /// @notice calculates the total amount of the reward that will be directed to the pool owner\\n    /// @return amount of tokens taken by the pool owner as commission\\n    function getCommission(uint256 posIndex, uint256 rewardAmount)\\n        external\\n        view\\n        returns (uint256);\\n}\\n\",\"keccak256\":\"0x6f0bafc511d75503c33709e4bb0d6c8cf191f06331e7fa4505540d8d1836e55a\",\"license\":\"Apache-2.0\"}},\"version\":1}",
  "storageLayout": {
    "storage": [],
    "types": null
  },
  "userdoc": {
    "kind": "user",
    "methods": {
      "getCommission(uint256,uint256)": {
        "notice": "calculates the total amount of the reward that will be directed to the pool owner"
      }
    },
    "notice": "This provides flexibility for different commission models",
    "version": 1
  }
}