{
  "contractName": "IUniswapV3PoolActions",
  "sourceName": "@uniswap/v3-core/contracts/interfaces/pool/IUniswapV3PoolActions.sol",
  "abi": [
    {
      "inputs": [
        {
          "internalType": "int24",
          "name": "tickLower",
          "type": "int24"
        },
        {
          "internalType": "int24",
          "name": "tickUpper",
          "type": "int24"
        },
        {
          "internalType": "uint128",
          "name": "amount",
          "type": "uint128"
        }
      ],
      "name": "burn",
      "outputs": [
        {
          "internalType": "uint256",
          "name": "amount0",
          "type": "uint256"
        },
        {
          "internalType": "uint256",
          "name": "amount1",
          "type": "uint256"
        }
      ],
      "stateMutability": "nonpayable",
      "type": "function"
    },
    {
      "inputs": [
        {
          "internalType": "address",
          "name": "recipient",
          "type": "address"
        },
        {
          "internalType": "int24",
          "name": "tickLower",
          "type": "int24"
        },
        {
          "internalType": "int24",
          "name": "tickUpper",
          "type": "int24"
        },
        {
          "internalType": "uint128",
          "name": "amount0Requested",
          "type": "uint128"
        },
        {
          "internalType": "uint128",
          "name": "amount1Requested",
          "type": "uint128"
        }
      ],
      "name": "collect",
      "outputs": [
        {
          "internalType": "uint128",
          "name": "amount0",
          "type": "uint128"
        },
        {
          "internalType": "uint128",
          "name": "amount1",
          "type": "uint128"
        }
      ],
      "stateMutability": "nonpayable",
      "type": "function"
    },
    {
      "inputs": [
        {
          "internalType": "address",
          "name": "recipient",
          "type": "address"
        },
        {
          "internalType": "uint256",
          "name": "amount0",
          "type": "uint256"
        },
        {
          "internalType": "uint256",
          "name": "amount1",
          "type": "uint256"
        },
        {
          "internalType": "bytes",
          "name": "data",
          "type": "bytes"
        }
      ],
      "name": "flash",
      "outputs": [],
      "stateMutability": "nonpayable",
      "type": "function"
    },
    {
      "inputs": [
        {
          "internalType": "uint16",
          "name": "observationCardinalityNext",
          "type": "uint16"
        }
      ],
      "name": "increaseObservationCardinalityNext",
      "outputs": [],
      "stateMutability": "nonpayable",
      "type": "function"
    },
    {
      "inputs": [
        {
          "internalType": "uint160",
          "name": "sqrtPriceX96",
          "type": "uint160"
        }
      ],
      "name": "initialize",
      "outputs": [],
      "stateMutability": "nonpayable",
      "type": "function"
    },
    {
      "inputs": [
        {
          "internalType": "address",
          "name": "recipient",
          "type": "address"
        },
        {
          "internalType": "int24",
          "name": "tickLower",
          "type": "int24"
        },
        {
          "internalType": "int24",
          "name": "tickUpper",
          "type": "int24"
        },
        {
          "internalType": "uint128",
          "name": "amount",
          "type": "uint128"
        },
        {
          "internalType": "bytes",
          "name": "data",
          "type": "bytes"
        }
      ],
      "name": "mint",
      "outputs": [
        {
          "internalType": "uint256",
          "name": "amount0",
          "type": "uint256"
        },
        {
          "internalType": "uint256",
          "name": "amount1",
          "type": "uint256"
        }
      ],
      "stateMutability": "nonpayable",
      "type": "function"
    },
    {
      "inputs": [
        {
          "internalType": "address",
          "name": "recipient",
          "type": "address"
        },
        {
          "internalType": "bool",
          "name": "zeroForOne",
          "type": "bool"
        },
        {
          "internalType": "int256",
          "name": "amountSpecified",
          "type": "int256"
        },
        {
          "internalType": "uint160",
          "name": "sqrtPriceLimitX96",
          "type": "uint160"
        },
        {
          "internalType": "bytes",
          "name": "data",
          "type": "bytes"
        }
      ],
      "name": "swap",
      "outputs": [
        {
          "internalType": "int256",
          "name": "amount0",
          "type": "int256"
        },
        {
          "internalType": "int256",
          "name": "amount1",
          "type": "int256"
        }
      ],
      "stateMutability": "nonpayable",
      "type": "function"
    }
  ],
  "bytecode": "0x",
  "deployedBytecode": "0x",
  "linkReferences": {},
  "deployedLinkReferences": {},
  "devdoc": {
    "kind": "dev",
    "methods": {
      "burn(int24,int24,uint128)": {
        "details": "Can be used to trigger a recalculation of fees owed to a position by calling with an amount of 0Fees must be collected separately via a call to #collect",
        "params": {
          "amount": "How much liquidity to burn",
          "tickLower": "The lower tick of the position for which to burn liquidity",
          "tickUpper": "The upper tick of the position for which to burn liquidity"
        },
        "returns": {
          "amount0": "The amount of token0 sent to the recipient",
          "amount1": "The amount of token1 sent to the recipient"
        }
      },
      "collect(address,int24,int24,uint128,uint128)": {
        "details": "Does not recompute fees earned, which must be done either via mint or burn of any amount of liquidity. Collect must be called by the position owner. To withdraw only token0 or only token1, amount0Requested or amount1Requested may be set to zero. To withdraw all tokens owed, caller may pass any value greater than the actual tokens owed, e.g. type(uint128).max. Tokens owed may be from accumulated swap fees or burned liquidity.",
        "params": {
          "amount0Requested": "How much token0 should be withdrawn from the fees owed",
          "amount1Requested": "How much token1 should be withdrawn from the fees owed",
          "recipient": "The address which should receive the fees collected",
          "tickLower": "The lower tick of the position for which to collect fees",
          "tickUpper": "The upper tick of the position for which to collect fees"
        },
        "returns": {
          "amount0": "The amount of fees collected in token0",
          "amount1": "The amount of fees collected in token1"
        }
      },
      "flash(address,uint256,uint256,bytes)": {
        "details": "The caller of this method receives a callback in the form of IUniswapV3FlashCallback#uniswapV3FlashCallbackCan be used to donate underlying tokens pro-rata to currently in-range liquidity providers by calling with 0 amount{0,1} and sending the donation amount(s) from the callback",
        "params": {
          "amount0": "The amount of token0 to send",
          "amount1": "The amount of token1 to send",
          "data": "Any data to be passed through to the callback",
          "recipient": "The address which will receive the token0 and token1 amounts"
        }
      },
      "increaseObservationCardinalityNext(uint16)": {
        "details": "This method is no-op if the pool already has an observationCardinalityNext greater than or equal to the input observationCardinalityNext.",
        "params": {
          "observationCardinalityNext": "The desired minimum number of observations for the pool to store"
        }
      },
      "initialize(uint160)": {
        "details": "Price is represented as a sqrt(amountToken1/amountToken0) Q64.96 value",
        "params": {
          "sqrtPriceX96": "the initial sqrt price of the pool as a Q64.96"
        }
      },
      "mint(address,int24,int24,uint128,bytes)": {
        "details": "The caller of this method receives a callback in the form of IUniswapV3MintCallback#uniswapV3MintCallback in which they must pay any token0 or token1 owed for the liquidity. The amount of token0/token1 due depends on tickLower, tickUpper, the amount of liquidity, and the current price.",
        "params": {
          "amount": "The amount of liquidity to mint",
          "data": "Any data that should be passed through to the callback",
          "recipient": "The address for which the liquidity will be created",
          "tickLower": "The lower tick of the position in which to add liquidity",
          "tickUpper": "The upper tick of the position in which to add liquidity"
        },
        "returns": {
          "amount0": "The amount of token0 that was paid to mint the given amount of liquidity. Matches the value in the callback",
          "amount1": "The amount of token1 that was paid to mint the given amount of liquidity. Matches the value in the callback"
        }
      },
      "swap(address,bool,int256,uint160,bytes)": {
        "details": "The caller of this method receives a callback in the form of IUniswapV3SwapCallback#uniswapV3SwapCallback",
        "params": {
          "amountSpecified": "The amount of the swap, which implicitly configures the swap as exact input (positive), or exact output (negative)",
          "data": "Any data to be passed through to the callback",
          "recipient": "The address to receive the output of the swap",
          "sqrtPriceLimitX96": "The Q64.96 sqrt price limit. If zero for one, the price cannot be less than this value after the swap. If one for zero, the price cannot be greater than this value after the swap",
          "zeroForOne": "The direction of the swap, true for token0 to token1, false for token1 to token0"
        },
        "returns": {
          "amount0": "The delta of the balance of token0 of the pool, exact when negative, minimum when positive",
          "amount1": "The delta of the balance of token1 of the pool, exact when negative, minimum when positive"
        }
      }
    },
    "title": "Permissionless pool actions",
    "version": 1
  },
  "evm": {
    "bytecode": {
      "functionDebugData": {},
      "generatedSources": [],
      "linkReferences": {},
      "object": "",
      "opcodes": "",
      "sourceMap": ""
    },
    "deployedBytecode": {
      "functionDebugData": {},
      "generatedSources": [],
      "immutableReferences": {},
      "linkReferences": {},
      "object": "",
      "opcodes": "",
      "sourceMap": ""
    },
    "gasEstimates": null,
    "methodIdentifiers": {
      "burn(int24,int24,uint128)": "a34123a7",
      "collect(address,int24,int24,uint128,uint128)": "4f1eb3d8",
      "flash(address,uint256,uint256,bytes)": "490e6cbc",
      "increaseObservationCardinalityNext(uint16)": "32148f67",
      "initialize(uint160)": "f637731d",
      "mint(address,int24,int24,uint128,bytes)": "3c8a7d8d",
      "swap(address,bool,int256,uint160,bytes)": "128acb08"
    }
  },
  "metadata": "{\"compiler\":{\"version\":\"0.8.6+commit.11564f7e\"},\"language\":\"Solidity\",\"output\":{\"abi\":[{\"inputs\":[{\"internalType\":\"int24\",\"name\":\"tickLower\",\"type\":\"int24\"},{\"internalType\":\"int24\",\"name\":\"tickUpper\",\"type\":\"int24\"},{\"internalType\":\"uint128\",\"name\":\"amount\",\"type\":\"uint128\"}],\"name\":\"burn\",\"outputs\":[{\"internalType\":\"uint256\",\"name\":\"amount0\",\"type\":\"uint256\"},{\"internalType\":\"uint256\",\"name\":\"amount1\",\"type\":\"uint256\"}],\"stateMutability\":\"nonpayable\",\"type\":\"function\"},{\"inputs\":[{\"internalType\":\"address\",\"name\":\"recipient\",\"type\":\"address\"},{\"internalType\":\"int24\",\"name\":\"tickLower\",\"type\":\"int24\"},{\"internalType\":\"int24\",\"name\":\"tickUpper\",\"type\":\"int24\"},{\"internalType\":\"uint128\",\"name\":\"amount0Requested\",\"type\":\"uint128\"},{\"internalType\":\"uint128\",\"name\":\"amount1Requested\",\"type\":\"uint128\"}],\"name\":\"collect\",\"outputs\":[{\"internalType\":\"uint128\",\"name\":\"amount0\",\"type\":\"uint128\"},{\"internalType\":\"uint128\",\"name\":\"amount1\",\"type\":\"uint128\"}],\"stateMutability\":\"nonpayable\",\"type\":\"function\"},{\"inputs\":[{\"internalType\":\"address\",\"name\":\"recipient\",\"type\":\"address\"},{\"internalType\":\"uint256\",\"name\":\"amount0\",\"type\":\"uint256\"},{\"internalType\":\"uint256\",\"name\":\"amount1\",\"type\":\"uint256\"},{\"internalType\":\"bytes\",\"name\":\"data\",\"type\":\"bytes\"}],\"name\":\"flash\",\"outputs\":[],\"stateMutability\":\"nonpayable\",\"type\":\"function\"},{\"inputs\":[{\"internalType\":\"uint16\",\"name\":\"observationCardinalityNext\",\"type\":\"uint16\"}],\"name\":\"increaseObservationCardinalityNext\",\"outputs\":[],\"stateMutability\":\"nonpayable\",\"type\":\"function\"},{\"inputs\":[{\"internalType\":\"uint160\",\"name\":\"sqrtPriceX96\",\"type\":\"uint160\"}],\"name\":\"initialize\",\"outputs\":[],\"stateMutability\":\"nonpayable\",\"type\":\"function\"},{\"inputs\":[{\"internalType\":\"address\",\"name\":\"recipient\",\"type\":\"address\"},{\"internalType\":\"int24\",\"name\":\"tickLower\",\"type\":\"int24\"},{\"internalType\":\"int24\",\"name\":\"tickUpper\",\"type\":\"int24\"},{\"internalType\":\"uint128\",\"name\":\"amount\",\"type\":\"uint128\"},{\"internalType\":\"bytes\",\"name\":\"data\",\"type\":\"bytes\"}],\"name\":\"mint\",\"outputs\":[{\"internalType\":\"uint256\",\"name\":\"amount0\",\"type\":\"uint256\"},{\"internalType\":\"uint256\",\"name\":\"amount1\",\"type\":\"uint256\"}],\"stateMutability\":\"nonpayable\",\"type\":\"function\"},{\"inputs\":[{\"internalType\":\"address\",\"name\":\"recipient\",\"type\":\"address\"},{\"internalType\":\"bool\",\"name\":\"zeroForOne\",\"type\":\"bool\"},{\"internalType\":\"int256\",\"name\":\"amountSpecified\",\"type\":\"int256\"},{\"internalType\":\"uint160\",\"name\":\"sqrtPriceLimitX96\",\"type\":\"uint160\"},{\"internalType\":\"bytes\",\"name\":\"data\",\"type\":\"bytes\"}],\"name\":\"swap\",\"outputs\":[{\"internalType\":\"int256\",\"name\":\"amount0\",\"type\":\"int256\"},{\"internalType\":\"int256\",\"name\":\"amount1\",\"type\":\"int256\"}],\"stateMutability\":\"nonpayable\",\"type\":\"function\"}],\"devdoc\":{\"kind\":\"dev\",\"methods\":{\"burn(int24,int24,uint128)\":{\"details\":\"Can be used to trigger a recalculation of fees owed to a position by calling with an amount of 0Fees must be collected separately via a call to #collect\",\"params\":{\"amount\":\"How much liquidity to burn\",\"tickLower\":\"The lower tick of the position for which to burn liquidity\",\"tickUpper\":\"The upper tick of the position for which to burn liquidity\"},\"returns\":{\"amount0\":\"The amount of token0 sent to the recipient\",\"amount1\":\"The amount of token1 sent to the recipient\"}},\"collect(address,int24,int24,uint128,uint128)\":{\"details\":\"Does not recompute fees earned, which must be done either via mint or burn of any amount of liquidity. Collect must be called by the position owner. To withdraw only token0 or only token1, amount0Requested or amount1Requested may be set to zero. To withdraw all tokens owed, caller may pass any value greater than the actual tokens owed, e.g. type(uint128).max. Tokens owed may be from accumulated swap fees or burned liquidity.\",\"params\":{\"amount0Requested\":\"How much token0 should be withdrawn from the fees owed\",\"amount1Requested\":\"How much token1 should be withdrawn from the fees owed\",\"recipient\":\"The address which should receive the fees collected\",\"tickLower\":\"The lower tick of the position for which to collect fees\",\"tickUpper\":\"The upper tick of the position for which to collect fees\"},\"returns\":{\"amount0\":\"The amount of fees collected in token0\",\"amount1\":\"The amount of fees collected in token1\"}},\"flash(address,uint256,uint256,bytes)\":{\"details\":\"The caller of this method receives a callback in the form of IUniswapV3FlashCallback#uniswapV3FlashCallbackCan be used to donate underlying tokens pro-rata to currently in-range liquidity providers by calling with 0 amount{0,1} and sending the donation amount(s) from the callback\",\"params\":{\"amount0\":\"The amount of token0 to send\",\"amount1\":\"The amount of token1 to send\",\"data\":\"Any data to be passed through to the callback\",\"recipient\":\"The address which will receive the token0 and token1 amounts\"}},\"increaseObservationCardinalityNext(uint16)\":{\"details\":\"This method is no-op if the pool already has an observationCardinalityNext greater than or equal to the input observationCardinalityNext.\",\"params\":{\"observationCardinalityNext\":\"The desired minimum number of observations for the pool to store\"}},\"initialize(uint160)\":{\"details\":\"Price is represented as a sqrt(amountToken1/amountToken0) Q64.96 value\",\"params\":{\"sqrtPriceX96\":\"the initial sqrt price of the pool as a Q64.96\"}},\"mint(address,int24,int24,uint128,bytes)\":{\"details\":\"The caller of this method receives a callback in the form of IUniswapV3MintCallback#uniswapV3MintCallback in which they must pay any token0 or token1 owed for the liquidity. The amount of token0/token1 due depends on tickLower, tickUpper, the amount of liquidity, and the current price.\",\"params\":{\"amount\":\"The amount of liquidity to mint\",\"data\":\"Any data that should be passed through to the callback\",\"recipient\":\"The address for which the liquidity will be created\",\"tickLower\":\"The lower tick of the position in which to add liquidity\",\"tickUpper\":\"The upper tick of the position in which to add liquidity\"},\"returns\":{\"amount0\":\"The amount of token0 that was paid to mint the given amount of liquidity. Matches the value in the callback\",\"amount1\":\"The amount of token1 that was paid to mint the given amount of liquidity. Matches the value in the callback\"}},\"swap(address,bool,int256,uint160,bytes)\":{\"details\":\"The caller of this method receives a callback in the form of IUniswapV3SwapCallback#uniswapV3SwapCallback\",\"params\":{\"amountSpecified\":\"The amount of the swap, which implicitly configures the swap as exact input (positive), or exact output (negative)\",\"data\":\"Any data to be passed through to the callback\",\"recipient\":\"The address to receive the output of the swap\",\"sqrtPriceLimitX96\":\"The Q64.96 sqrt price limit. If zero for one, the price cannot be less than this value after the swap. If one for zero, the price cannot be greater than this value after the swap\",\"zeroForOne\":\"The direction of the swap, true for token0 to token1, false for token1 to token0\"},\"returns\":{\"amount0\":\"The delta of the balance of token0 of the pool, exact when negative, minimum when positive\",\"amount1\":\"The delta of the balance of token1 of the pool, exact when negative, minimum when positive\"}}},\"title\":\"Permissionless pool actions\",\"version\":1},\"userdoc\":{\"kind\":\"user\",\"methods\":{\"burn(int24,int24,uint128)\":{\"notice\":\"Burn liquidity from the sender and account tokens owed for the liquidity to the position\"},\"collect(address,int24,int24,uint128,uint128)\":{\"notice\":\"Collects tokens owed to a position\"},\"flash(address,uint256,uint256,bytes)\":{\"notice\":\"Receive token0 and/or token1 and pay it back, plus a fee, in the callback\"},\"increaseObservationCardinalityNext(uint16)\":{\"notice\":\"Increase the maximum number of price and liquidity observations that this pool will store\"},\"initialize(uint160)\":{\"notice\":\"Sets the initial price for the pool\"},\"mint(address,int24,int24,uint128,bytes)\":{\"notice\":\"Adds liquidity for the given recipient/tickLower/tickUpper position\"},\"swap(address,bool,int256,uint160,bytes)\":{\"notice\":\"Swap token0 for token1, or token1 for token0\"}},\"notice\":\"Contains pool methods that can be called by anyone\",\"version\":1}},\"settings\":{\"compilationTarget\":{\"@uniswap/v3-core/contracts/interfaces/pool/IUniswapV3PoolActions.sol\":\"IUniswapV3PoolActions\"},\"evmVersion\":\"berlin\",\"libraries\":{},\"metadata\":{\"bytecodeHash\":\"ipfs\",\"useLiteralContent\":true},\"optimizer\":{\"enabled\":true,\"runs\":200},\"remappings\":[]},\"sources\":{\"@uniswap/v3-core/contracts/interfaces/pool/IUniswapV3PoolActions.sol\":{\"content\":\"// SPDX-License-Identifier: GPL-2.0-or-later\\npragma solidity >=0.5.0;\\n\\n/// @title Permissionless pool actions\\n/// @notice Contains pool methods that can be called by anyone\\ninterface IUniswapV3PoolActions {\\n    /// @notice Sets the initial price for the pool\\n    /// @dev Price is represented as a sqrt(amountToken1/amountToken0) Q64.96 value\\n    /// @param sqrtPriceX96 the initial sqrt price of the pool as a Q64.96\\n    function initialize(uint160 sqrtPriceX96) external;\\n\\n    /// @notice Adds liquidity for the given recipient/tickLower/tickUpper position\\n    /// @dev The caller of this method receives a callback in the form of IUniswapV3MintCallback#uniswapV3MintCallback\\n    /// in which they must pay any token0 or token1 owed for the liquidity. The amount of token0/token1 due depends\\n    /// on tickLower, tickUpper, the amount of liquidity, and the current price.\\n    /// @param recipient The address for which the liquidity will be created\\n    /// @param tickLower The lower tick of the position in which to add liquidity\\n    /// @param tickUpper The upper tick of the position in which to add liquidity\\n    /// @param amount The amount of liquidity to mint\\n    /// @param data Any data that should be passed through to the callback\\n    /// @return amount0 The amount of token0 that was paid to mint the given amount of liquidity. Matches the value in the callback\\n    /// @return amount1 The amount of token1 that was paid to mint the given amount of liquidity. Matches the value in the callback\\n    function mint(\\n        address recipient,\\n        int24 tickLower,\\n        int24 tickUpper,\\n        uint128 amount,\\n        bytes calldata data\\n    ) external returns (uint256 amount0, uint256 amount1);\\n\\n    /// @notice Collects tokens owed to a position\\n    /// @dev Does not recompute fees earned, which must be done either via mint or burn of any amount of liquidity.\\n    /// Collect must be called by the position owner. To withdraw only token0 or only token1, amount0Requested or\\n    /// amount1Requested may be set to zero. To withdraw all tokens owed, caller may pass any value greater than the\\n    /// actual tokens owed, e.g. type(uint128).max. Tokens owed may be from accumulated swap fees or burned liquidity.\\n    /// @param recipient The address which should receive the fees collected\\n    /// @param tickLower The lower tick of the position for which to collect fees\\n    /// @param tickUpper The upper tick of the position for which to collect fees\\n    /// @param amount0Requested How much token0 should be withdrawn from the fees owed\\n    /// @param amount1Requested How much token1 should be withdrawn from the fees owed\\n    /// @return amount0 The amount of fees collected in token0\\n    /// @return amount1 The amount of fees collected in token1\\n    function collect(\\n        address recipient,\\n        int24 tickLower,\\n        int24 tickUpper,\\n        uint128 amount0Requested,\\n        uint128 amount1Requested\\n    ) external returns (uint128 amount0, uint128 amount1);\\n\\n    /// @notice Burn liquidity from the sender and account tokens owed for the liquidity to the position\\n    /// @dev Can be used to trigger a recalculation of fees owed to a position by calling with an amount of 0\\n    /// @dev Fees must be collected separately via a call to #collect\\n    /// @param tickLower The lower tick of the position for which to burn liquidity\\n    /// @param tickUpper The upper tick of the position for which to burn liquidity\\n    /// @param amount How much liquidity to burn\\n    /// @return amount0 The amount of token0 sent to the recipient\\n    /// @return amount1 The amount of token1 sent to the recipient\\n    function burn(\\n        int24 tickLower,\\n        int24 tickUpper,\\n        uint128 amount\\n    ) external returns (uint256 amount0, uint256 amount1);\\n\\n    /// @notice Swap token0 for token1, or token1 for token0\\n    /// @dev The caller of this method receives a callback in the form of IUniswapV3SwapCallback#uniswapV3SwapCallback\\n    /// @param recipient The address to receive the output of the swap\\n    /// @param zeroForOne The direction of the swap, true for token0 to token1, false for token1 to token0\\n    /// @param amountSpecified The amount of the swap, which implicitly configures the swap as exact input (positive), or exact output (negative)\\n    /// @param sqrtPriceLimitX96 The Q64.96 sqrt price limit. If zero for one, the price cannot be less than this\\n    /// value after the swap. If one for zero, the price cannot be greater than this value after the swap\\n    /// @param data Any data to be passed through to the callback\\n    /// @return amount0 The delta of the balance of token0 of the pool, exact when negative, minimum when positive\\n    /// @return amount1 The delta of the balance of token1 of the pool, exact when negative, minimum when positive\\n    function swap(\\n        address recipient,\\n        bool zeroForOne,\\n        int256 amountSpecified,\\n        uint160 sqrtPriceLimitX96,\\n        bytes calldata data\\n    ) external returns (int256 amount0, int256 amount1);\\n\\n    /// @notice Receive token0 and/or token1 and pay it back, plus a fee, in the callback\\n    /// @dev The caller of this method receives a callback in the form of IUniswapV3FlashCallback#uniswapV3FlashCallback\\n    /// @dev Can be used to donate underlying tokens pro-rata to currently in-range liquidity providers by calling\\n    /// with 0 amount{0,1} and sending the donation amount(s) from the callback\\n    /// @param recipient The address which will receive the token0 and token1 amounts\\n    /// @param amount0 The amount of token0 to send\\n    /// @param amount1 The amount of token1 to send\\n    /// @param data Any data to be passed through to the callback\\n    function flash(\\n        address recipient,\\n        uint256 amount0,\\n        uint256 amount1,\\n        bytes calldata data\\n    ) external;\\n\\n    /// @notice Increase the maximum number of price and liquidity observations that this pool will store\\n    /// @dev This method is no-op if the pool already has an observationCardinalityNext greater than or equal to\\n    /// the input observationCardinalityNext.\\n    /// @param observationCardinalityNext The desired minimum number of observations for the pool to store\\n    function increaseObservationCardinalityNext(uint16 observationCardinalityNext) external;\\n}\\n\",\"keccak256\":\"0x9453dd0e7442188667d01d9b65de3f1e14e9511ff3e303179a15f6fc267f7634\",\"license\":\"GPL-2.0-or-later\"}},\"version\":1}",
  "storageLayout": {
    "storage": [],
    "types": null
  },
  "userdoc": {
    "kind": "user",
    "methods": {
      "burn(int24,int24,uint128)": {
        "notice": "Burn liquidity from the sender and account tokens owed for the liquidity to the position"
      },
      "collect(address,int24,int24,uint128,uint128)": {
        "notice": "Collects tokens owed to a position"
      },
      "flash(address,uint256,uint256,bytes)": {
        "notice": "Receive token0 and/or token1 and pay it back, plus a fee, in the callback"
      },
      "increaseObservationCardinalityNext(uint16)": {
        "notice": "Increase the maximum number of price and liquidity observations that this pool will store"
      },
      "initialize(uint160)": {
        "notice": "Sets the initial price for the pool"
      },
      "mint(address,int24,int24,uint128,bytes)": {
        "notice": "Adds liquidity for the given recipient/tickLower/tickUpper position"
      },
      "swap(address,bool,int256,uint160,bytes)": {
        "notice": "Swap token0 for token1, or token1 for token0"
      }
    },
    "notice": "Contains pool methods that can be called by anyone",
    "version": 1
  }
}