{
  "contractName": "IUniswapV3PoolImmutables",
  "sourceName": "@uniswap/v3-core/contracts/interfaces/pool/IUniswapV3PoolImmutables.sol",
  "abi": [
    {
      "inputs": [],
      "name": "factory",
      "outputs": [
        {
          "internalType": "address",
          "name": "",
          "type": "address"
        }
      ],
      "stateMutability": "view",
      "type": "function"
    },
    {
      "inputs": [],
      "name": "fee",
      "outputs": [
        {
          "internalType": "uint24",
          "name": "",
          "type": "uint24"
        }
      ],
      "stateMutability": "view",
      "type": "function"
    },
    {
      "inputs": [],
      "name": "maxLiquidityPerTick",
      "outputs": [
        {
          "internalType": "uint128",
          "name": "",
          "type": "uint128"
        }
      ],
      "stateMutability": "view",
      "type": "function"
    },
    {
      "inputs": [],
      "name": "tickSpacing",
      "outputs": [
        {
          "internalType": "int24",
          "name": "",
          "type": "int24"
        }
      ],
      "stateMutability": "view",
      "type": "function"
    },
    {
      "inputs": [],
      "name": "token0",
      "outputs": [
        {
          "internalType": "address",
          "name": "",
          "type": "address"
        }
      ],
      "stateMutability": "view",
      "type": "function"
    },
    {
      "inputs": [],
      "name": "token1",
      "outputs": [
        {
          "internalType": "address",
          "name": "",
          "type": "address"
        }
      ],
      "stateMutability": "view",
      "type": "function"
    }
  ],
  "bytecode": "0x",
  "deployedBytecode": "0x",
  "linkReferences": {},
  "deployedLinkReferences": {},
  "devdoc": {
    "kind": "dev",
    "methods": {
      "factory()": {
        "returns": {
          "_0": "The contract address"
        }
      },
      "fee()": {
        "returns": {
          "_0": "The fee"
        }
      },
      "maxLiquidityPerTick()": {
        "details": "This parameter is enforced per tick to prevent liquidity from overflowing a uint128 at any point, and also prevents out-of-range liquidity from being used to prevent adding in-range liquidity to a pool",
        "returns": {
          "_0": "The max amount of liquidity per tick"
        }
      },
      "tickSpacing()": {
        "details": "Ticks can only be used at multiples of this value, minimum of 1 and always positive e.g.: a tickSpacing of 3 means ticks can be initialized every 3rd tick, i.e., ..., -6, -3, 0, 3, 6, ... This value is an int24 to avoid casting even though it is always positive.",
        "returns": {
          "_0": "The tick spacing"
        }
      },
      "token0()": {
        "returns": {
          "_0": "The token contract address"
        }
      },
      "token1()": {
        "returns": {
          "_0": "The token contract address"
        }
      }
    },
    "title": "Pool state that never changes",
    "version": 1
  },
  "evm": {
    "bytecode": {
      "functionDebugData": {},
      "generatedSources": [],
      "linkReferences": {},
      "object": "",
      "opcodes": "",
      "sourceMap": ""
    },
    "deployedBytecode": {
      "functionDebugData": {},
      "generatedSources": [],
      "immutableReferences": {},
      "linkReferences": {},
      "object": "",
      "opcodes": "",
      "sourceMap": ""
    },
    "gasEstimates": null,
    "methodIdentifiers": {
      "factory()": "c45a0155",
      "fee()": "ddca3f43",
      "maxLiquidityPerTick()": "70cf754a",
      "tickSpacing()": "d0c93a7c",
      "token0()": "0dfe1681",
      "token1()": "d21220a7"
    }
  },
  "metadata": "{\"compiler\":{\"version\":\"0.8.6+commit.11564f7e\"},\"language\":\"Solidity\",\"output\":{\"abi\":[{\"inputs\":[],\"name\":\"factory\",\"outputs\":[{\"internalType\":\"address\",\"name\":\"\",\"type\":\"address\"}],\"stateMutability\":\"view\",\"type\":\"function\"},{\"inputs\":[],\"name\":\"fee\",\"outputs\":[{\"internalType\":\"uint24\",\"name\":\"\",\"type\":\"uint24\"}],\"stateMutability\":\"view\",\"type\":\"function\"},{\"inputs\":[],\"name\":\"maxLiquidityPerTick\",\"outputs\":[{\"internalType\":\"uint128\",\"name\":\"\",\"type\":\"uint128\"}],\"stateMutability\":\"view\",\"type\":\"function\"},{\"inputs\":[],\"name\":\"tickSpacing\",\"outputs\":[{\"internalType\":\"int24\",\"name\":\"\",\"type\":\"int24\"}],\"stateMutability\":\"view\",\"type\":\"function\"},{\"inputs\":[],\"name\":\"token0\",\"outputs\":[{\"internalType\":\"address\",\"name\":\"\",\"type\":\"address\"}],\"stateMutability\":\"view\",\"type\":\"function\"},{\"inputs\":[],\"name\":\"token1\",\"outputs\":[{\"internalType\":\"address\",\"name\":\"\",\"type\":\"address\"}],\"stateMutability\":\"view\",\"type\":\"function\"}],\"devdoc\":{\"kind\":\"dev\",\"methods\":{\"factory()\":{\"returns\":{\"_0\":\"The contract address\"}},\"fee()\":{\"returns\":{\"_0\":\"The fee\"}},\"maxLiquidityPerTick()\":{\"details\":\"This parameter is enforced per tick to prevent liquidity from overflowing a uint128 at any point, and also prevents out-of-range liquidity from being used to prevent adding in-range liquidity to a pool\",\"returns\":{\"_0\":\"The max amount of liquidity per tick\"}},\"tickSpacing()\":{\"details\":\"Ticks can only be used at multiples of this value, minimum of 1 and always positive e.g.: a tickSpacing of 3 means ticks can be initialized every 3rd tick, i.e., ..., -6, -3, 0, 3, 6, ... This value is an int24 to avoid casting even though it is always positive.\",\"returns\":{\"_0\":\"The tick spacing\"}},\"token0()\":{\"returns\":{\"_0\":\"The token contract address\"}},\"token1()\":{\"returns\":{\"_0\":\"The token contract address\"}}},\"title\":\"Pool state that never changes\",\"version\":1},\"userdoc\":{\"kind\":\"user\",\"methods\":{\"factory()\":{\"notice\":\"The contract that deployed the pool, which must adhere to the IUniswapV3Factory interface\"},\"fee()\":{\"notice\":\"The pool's fee in hundredths of a bip, i.e. 1e-6\"},\"maxLiquidityPerTick()\":{\"notice\":\"The maximum amount of position liquidity that can use any tick in the range\"},\"tickSpacing()\":{\"notice\":\"The pool tick spacing\"},\"token0()\":{\"notice\":\"The first of the two tokens of the pool, sorted by address\"},\"token1()\":{\"notice\":\"The second of the two tokens of the pool, sorted by address\"}},\"notice\":\"These parameters are fixed for a pool forever, i.e., the methods will always return the same values\",\"version\":1}},\"settings\":{\"compilationTarget\":{\"@uniswap/v3-core/contracts/interfaces/pool/IUniswapV3PoolImmutables.sol\":\"IUniswapV3PoolImmutables\"},\"evmVersion\":\"berlin\",\"libraries\":{},\"metadata\":{\"bytecodeHash\":\"ipfs\",\"useLiteralContent\":true},\"optimizer\":{\"enabled\":true,\"runs\":200},\"remappings\":[]},\"sources\":{\"@uniswap/v3-core/contracts/interfaces/pool/IUniswapV3PoolImmutables.sol\":{\"content\":\"// SPDX-License-Identifier: GPL-2.0-or-later\\npragma solidity >=0.5.0;\\n\\n/// @title Pool state that never changes\\n/// @notice These parameters are fixed for a pool forever, i.e., the methods will always return the same values\\ninterface IUniswapV3PoolImmutables {\\n    /// @notice The contract that deployed the pool, which must adhere to the IUniswapV3Factory interface\\n    /// @return The contract address\\n    function factory() external view returns (address);\\n\\n    /// @notice The first of the two tokens of the pool, sorted by address\\n    /// @return The token contract address\\n    function token0() external view returns (address);\\n\\n    /// @notice The second of the two tokens of the pool, sorted by address\\n    /// @return The token contract address\\n    function token1() external view returns (address);\\n\\n    /// @notice The pool's fee in hundredths of a bip, i.e. 1e-6\\n    /// @return The fee\\n    function fee() external view returns (uint24);\\n\\n    /// @notice The pool tick spacing\\n    /// @dev Ticks can only be used at multiples of this value, minimum of 1 and always positive\\n    /// e.g.: a tickSpacing of 3 means ticks can be initialized every 3rd tick, i.e., ..., -6, -3, 0, 3, 6, ...\\n    /// This value is an int24 to avoid casting even though it is always positive.\\n    /// @return The tick spacing\\n    function tickSpacing() external view returns (int24);\\n\\n    /// @notice The maximum amount of position liquidity that can use any tick in the range\\n    /// @dev This parameter is enforced per tick to prevent liquidity from overflowing a uint128 at any point, and\\n    /// also prevents out-of-range liquidity from being used to prevent adding in-range liquidity to a pool\\n    /// @return The max amount of liquidity per tick\\n    function maxLiquidityPerTick() external view returns (uint128);\\n}\\n\",\"keccak256\":\"0xf6e5d2cd1139c4c276bdbc8e1d2b256e456c866a91f1b868da265c6d2685c3f7\",\"license\":\"GPL-2.0-or-later\"}},\"version\":1}",
  "storageLayout": {
    "storage": [],
    "types": null
  },
  "userdoc": {
    "kind": "user",
    "methods": {
      "factory()": {
        "notice": "The contract that deployed the pool, which must adhere to the IUniswapV3Factory interface"
      },
      "fee()": {
        "notice": "The pool's fee in hundredths of a bip, i.e. 1e-6"
      },
      "maxLiquidityPerTick()": {
        "notice": "The maximum amount of position liquidity that can use any tick in the range"
      },
      "tickSpacing()": {
        "notice": "The pool tick spacing"
      },
      "token0()": {
        "notice": "The first of the two tokens of the pool, sorted by address"
      },
      "token1()": {
        "notice": "The second of the two tokens of the pool, sorted by address"
      }
    },
    "notice": "These parameters are fixed for a pool forever, i.e., the methods will always return the same values",
    "version": 1
  }
}