{
  "contractName": "IUniswapV3PoolState",
  "sourceName": "@uniswap/v3-core/contracts/interfaces/pool/IUniswapV3PoolState.sol",
  "abi": [
    {
      "inputs": [],
      "name": "feeGrowthGlobal0X128",
      "outputs": [
        {
          "internalType": "uint256",
          "name": "",
          "type": "uint256"
        }
      ],
      "stateMutability": "view",
      "type": "function"
    },
    {
      "inputs": [],
      "name": "feeGrowthGlobal1X128",
      "outputs": [
        {
          "internalType": "uint256",
          "name": "",
          "type": "uint256"
        }
      ],
      "stateMutability": "view",
      "type": "function"
    },
    {
      "inputs": [],
      "name": "liquidity",
      "outputs": [
        {
          "internalType": "uint128",
          "name": "",
          "type": "uint128"
        }
      ],
      "stateMutability": "view",
      "type": "function"
    },
    {
      "inputs": [
        {
          "internalType": "uint256",
          "name": "index",
          "type": "uint256"
        }
      ],
      "name": "observations",
      "outputs": [
        {
          "internalType": "uint32",
          "name": "blockTimestamp",
          "type": "uint32"
        },
        {
          "internalType": "int56",
          "name": "tickCumulative",
          "type": "int56"
        },
        {
          "internalType": "uint160",
          "name": "secondsPerLiquidityCumulativeX128",
          "type": "uint160"
        },
        {
          "internalType": "bool",
          "name": "initialized",
          "type": "bool"
        }
      ],
      "stateMutability": "view",
      "type": "function"
    },
    {
      "inputs": [
        {
          "internalType": "bytes32",
          "name": "key",
          "type": "bytes32"
        }
      ],
      "name": "positions",
      "outputs": [
        {
          "internalType": "uint128",
          "name": "_liquidity",
          "type": "uint128"
        },
        {
          "internalType": "uint256",
          "name": "feeGrowthInside0LastX128",
          "type": "uint256"
        },
        {
          "internalType": "uint256",
          "name": "feeGrowthInside1LastX128",
          "type": "uint256"
        },
        {
          "internalType": "uint128",
          "name": "tokensOwed0",
          "type": "uint128"
        },
        {
          "internalType": "uint128",
          "name": "tokensOwed1",
          "type": "uint128"
        }
      ],
      "stateMutability": "view",
      "type": "function"
    },
    {
      "inputs": [],
      "name": "protocolFees",
      "outputs": [
        {
          "internalType": "uint128",
          "name": "token0",
          "type": "uint128"
        },
        {
          "internalType": "uint128",
          "name": "token1",
          "type": "uint128"
        }
      ],
      "stateMutability": "view",
      "type": "function"
    },
    {
      "inputs": [],
      "name": "slot0",
      "outputs": [
        {
          "internalType": "uint160",
          "name": "sqrtPriceX96",
          "type": "uint160"
        },
        {
          "internalType": "int24",
          "name": "tick",
          "type": "int24"
        },
        {
          "internalType": "uint16",
          "name": "observationIndex",
          "type": "uint16"
        },
        {
          "internalType": "uint16",
          "name": "observationCardinality",
          "type": "uint16"
        },
        {
          "internalType": "uint16",
          "name": "observationCardinalityNext",
          "type": "uint16"
        },
        {
          "internalType": "uint8",
          "name": "feeProtocol",
          "type": "uint8"
        },
        {
          "internalType": "bool",
          "name": "unlocked",
          "type": "bool"
        }
      ],
      "stateMutability": "view",
      "type": "function"
    },
    {
      "inputs": [
        {
          "internalType": "int16",
          "name": "wordPosition",
          "type": "int16"
        }
      ],
      "name": "tickBitmap",
      "outputs": [
        {
          "internalType": "uint256",
          "name": "",
          "type": "uint256"
        }
      ],
      "stateMutability": "view",
      "type": "function"
    },
    {
      "inputs": [
        {
          "internalType": "int24",
          "name": "tick",
          "type": "int24"
        }
      ],
      "name": "ticks",
      "outputs": [
        {
          "internalType": "uint128",
          "name": "liquidityGross",
          "type": "uint128"
        },
        {
          "internalType": "int128",
          "name": "liquidityNet",
          "type": "int128"
        },
        {
          "internalType": "uint256",
          "name": "feeGrowthOutside0X128",
          "type": "uint256"
        },
        {
          "internalType": "uint256",
          "name": "feeGrowthOutside1X128",
          "type": "uint256"
        },
        {
          "internalType": "int56",
          "name": "tickCumulativeOutside",
          "type": "int56"
        },
        {
          "internalType": "uint160",
          "name": "secondsPerLiquidityOutsideX128",
          "type": "uint160"
        },
        {
          "internalType": "uint32",
          "name": "secondsOutside",
          "type": "uint32"
        },
        {
          "internalType": "bool",
          "name": "initialized",
          "type": "bool"
        }
      ],
      "stateMutability": "view",
      "type": "function"
    }
  ],
  "bytecode": "0x",
  "deployedBytecode": "0x",
  "linkReferences": {},
  "deployedLinkReferences": {},
  "devdoc": {
    "kind": "dev",
    "methods": {
      "feeGrowthGlobal0X128()": {
        "details": "This value can overflow the uint256"
      },
      "feeGrowthGlobal1X128()": {
        "details": "This value can overflow the uint256"
      },
      "liquidity()": {
        "details": "This value has no relationship to the total liquidity across all ticks"
      },
      "observations(uint256)": {
        "details": "You most likely want to use #observe() instead of this method to get an observation as of some amount of time ago, rather than at a specific index in the array.",
        "params": {
          "index": "The element of the observations array to fetch"
        },
        "returns": {
          "blockTimestamp": "The timestamp of the observation, Returns tickCumulative the tick multiplied by seconds elapsed for the life of the pool as of the observation timestamp, Returns secondsPerLiquidityCumulativeX128 the seconds per in range liquidity for the life of the pool as of the observation timestamp, Returns initialized whether the observation has been initialized and the values are safe to use"
        }
      },
      "positions(bytes32)": {
        "params": {
          "key": "The position's key is a hash of a preimage composed by the owner, tickLower and tickUpper"
        },
        "returns": {
          "_liquidity": "The amount of liquidity in the position, Returns feeGrowthInside0LastX128 fee growth of token0 inside the tick range as of the last mint/burn/poke, Returns feeGrowthInside1LastX128 fee growth of token1 inside the tick range as of the last mint/burn/poke, Returns tokensOwed0 the computed amount of token0 owed to the position as of the last mint/burn/poke, Returns tokensOwed1 the computed amount of token1 owed to the position as of the last mint/burn/poke"
        }
      },
      "protocolFees()": {
        "details": "Protocol fees will never exceed uint128 max in either token"
      },
      "slot0()": {
        "returns": {
          "sqrtPriceX96": "The current price of the pool as a sqrt(token1/token0) Q64.96 value tick The current tick of the pool, i.e. according to the last tick transition that was run. This value may not always be equal to SqrtTickMath.getTickAtSqrtRatio(sqrtPriceX96) if the price is on a tick boundary. observationIndex The index of the last oracle observation that was written, observationCardinality The current maximum number of observations stored in the pool, observationCardinalityNext The next maximum number of observations, to be updated when the observation. feeProtocol The protocol fee for both tokens of the pool. Encoded as two 4 bit values, where the protocol fee of token1 is shifted 4 bits and the protocol fee of token0 is the lower 4 bits. Used as the denominator of a fraction of the swap fee, e.g. 4 means 1/4th of the swap fee. unlocked Whether the pool is currently locked to reentrancy"
        }
      },
      "ticks(int24)": {
        "params": {
          "tick": "The tick to look up"
        },
        "returns": {
          "liquidityGross": "the total amount of position liquidity that uses the pool either as tick lower or tick upper, liquidityNet how much liquidity changes when the pool price crosses the tick, feeGrowthOutside0X128 the fee growth on the other side of the tick from the current tick in token0, feeGrowthOutside1X128 the fee growth on the other side of the tick from the current tick in token1, tickCumulativeOutside the cumulative tick value on the other side of the tick from the current tick secondsPerLiquidityOutsideX128 the seconds spent per liquidity on the other side of the tick from the current tick, secondsOutside the seconds spent on the other side of the tick from the current tick, initialized Set to true if the tick is initialized, i.e. liquidityGross is greater than 0, otherwise equal to false. Outside values can only be used if the tick is initialized, i.e. if liquidityGross is greater than 0. In addition, these values are only relative and must be used only in comparison to previous snapshots for a specific position."
        }
      }
    },
    "title": "Pool state that can change",
    "version": 1
  },
  "evm": {
    "bytecode": {
      "functionDebugData": {},
      "generatedSources": [],
      "linkReferences": {},
      "object": "",
      "opcodes": "",
      "sourceMap": ""
    },
    "deployedBytecode": {
      "functionDebugData": {},
      "generatedSources": [],
      "immutableReferences": {},
      "linkReferences": {},
      "object": "",
      "opcodes": "",
      "sourceMap": ""
    },
    "gasEstimates": null,
    "methodIdentifiers": {
      "feeGrowthGlobal0X128()": "f3058399",
      "feeGrowthGlobal1X128()": "46141319",
      "liquidity()": "1a686502",
      "observations(uint256)": "252c09d7",
      "positions(bytes32)": "514ea4bf",
      "protocolFees()": "1ad8b03b",
      "slot0()": "3850c7bd",
      "tickBitmap(int16)": "5339c296",
      "ticks(int24)": "f30dba93"
    }
  },
  "metadata": "{\"compiler\":{\"version\":\"0.8.6+commit.11564f7e\"},\"language\":\"Solidity\",\"output\":{\"abi\":[{\"inputs\":[],\"name\":\"feeGrowthGlobal0X128\",\"outputs\":[{\"internalType\":\"uint256\",\"name\":\"\",\"type\":\"uint256\"}],\"stateMutability\":\"view\",\"type\":\"function\"},{\"inputs\":[],\"name\":\"feeGrowthGlobal1X128\",\"outputs\":[{\"internalType\":\"uint256\",\"name\":\"\",\"type\":\"uint256\"}],\"stateMutability\":\"view\",\"type\":\"function\"},{\"inputs\":[],\"name\":\"liquidity\",\"outputs\":[{\"internalType\":\"uint128\",\"name\":\"\",\"type\":\"uint128\"}],\"stateMutability\":\"view\",\"type\":\"function\"},{\"inputs\":[{\"internalType\":\"uint256\",\"name\":\"index\",\"type\":\"uint256\"}],\"name\":\"observations\",\"outputs\":[{\"internalType\":\"uint32\",\"name\":\"blockTimestamp\",\"type\":\"uint32\"},{\"internalType\":\"int56\",\"name\":\"tickCumulative\",\"type\":\"int56\"},{\"internalType\":\"uint160\",\"name\":\"secondsPerLiquidityCumulativeX128\",\"type\":\"uint160\"},{\"internalType\":\"bool\",\"name\":\"initialized\",\"type\":\"bool\"}],\"stateMutability\":\"view\",\"type\":\"function\"},{\"inputs\":[{\"internalType\":\"bytes32\",\"name\":\"key\",\"type\":\"bytes32\"}],\"name\":\"positions\",\"outputs\":[{\"internalType\":\"uint128\",\"name\":\"_liquidity\",\"type\":\"uint128\"},{\"internalType\":\"uint256\",\"name\":\"feeGrowthInside0LastX128\",\"type\":\"uint256\"},{\"internalType\":\"uint256\",\"name\":\"feeGrowthInside1LastX128\",\"type\":\"uint256\"},{\"internalType\":\"uint128\",\"name\":\"tokensOwed0\",\"type\":\"uint128\"},{\"internalType\":\"uint128\",\"name\":\"tokensOwed1\",\"type\":\"uint128\"}],\"stateMutability\":\"view\",\"type\":\"function\"},{\"inputs\":[],\"name\":\"protocolFees\",\"outputs\":[{\"internalType\":\"uint128\",\"name\":\"token0\",\"type\":\"uint128\"},{\"internalType\":\"uint128\",\"name\":\"token1\",\"type\":\"uint128\"}],\"stateMutability\":\"view\",\"type\":\"function\"},{\"inputs\":[],\"name\":\"slot0\",\"outputs\":[{\"internalType\":\"uint160\",\"name\":\"sqrtPriceX96\",\"type\":\"uint160\"},{\"internalType\":\"int24\",\"name\":\"tick\",\"type\":\"int24\"},{\"internalType\":\"uint16\",\"name\":\"observationIndex\",\"type\":\"uint16\"},{\"internalType\":\"uint16\",\"name\":\"observationCardinality\",\"type\":\"uint16\"},{\"internalType\":\"uint16\",\"name\":\"observationCardinalityNext\",\"type\":\"uint16\"},{\"internalType\":\"uint8\",\"name\":\"feeProtocol\",\"type\":\"uint8\"},{\"internalType\":\"bool\",\"name\":\"unlocked\",\"type\":\"bool\"}],\"stateMutability\":\"view\",\"type\":\"function\"},{\"inputs\":[{\"internalType\":\"int16\",\"name\":\"wordPosition\",\"type\":\"int16\"}],\"name\":\"tickBitmap\",\"outputs\":[{\"internalType\":\"uint256\",\"name\":\"\",\"type\":\"uint256\"}],\"stateMutability\":\"view\",\"type\":\"function\"},{\"inputs\":[{\"internalType\":\"int24\",\"name\":\"tick\",\"type\":\"int24\"}],\"name\":\"ticks\",\"outputs\":[{\"internalType\":\"uint128\",\"name\":\"liquidityGross\",\"type\":\"uint128\"},{\"internalType\":\"int128\",\"name\":\"liquidityNet\",\"type\":\"int128\"},{\"internalType\":\"uint256\",\"name\":\"feeGrowthOutside0X128\",\"type\":\"uint256\"},{\"internalType\":\"uint256\",\"name\":\"feeGrowthOutside1X128\",\"type\":\"uint256\"},{\"internalType\":\"int56\",\"name\":\"tickCumulativeOutside\",\"type\":\"int56\"},{\"internalType\":\"uint160\",\"name\":\"secondsPerLiquidityOutsideX128\",\"type\":\"uint160\"},{\"internalType\":\"uint32\",\"name\":\"secondsOutside\",\"type\":\"uint32\"},{\"internalType\":\"bool\",\"name\":\"initialized\",\"type\":\"bool\"}],\"stateMutability\":\"view\",\"type\":\"function\"}],\"devdoc\":{\"kind\":\"dev\",\"methods\":{\"feeGrowthGlobal0X128()\":{\"details\":\"This value can overflow the uint256\"},\"feeGrowthGlobal1X128()\":{\"details\":\"This value can overflow the uint256\"},\"liquidity()\":{\"details\":\"This value has no relationship to the total liquidity across all ticks\"},\"observations(uint256)\":{\"details\":\"You most likely want to use #observe() instead of this method to get an observation as of some amount of time ago, rather than at a specific index in the array.\",\"params\":{\"index\":\"The element of the observations array to fetch\"},\"returns\":{\"blockTimestamp\":\"The timestamp of the observation, Returns tickCumulative the tick multiplied by seconds elapsed for the life of the pool as of the observation timestamp, Returns secondsPerLiquidityCumulativeX128 the seconds per in range liquidity for the life of the pool as of the observation timestamp, Returns initialized whether the observation has been initialized and the values are safe to use\"}},\"positions(bytes32)\":{\"params\":{\"key\":\"The position's key is a hash of a preimage composed by the owner, tickLower and tickUpper\"},\"returns\":{\"_liquidity\":\"The amount of liquidity in the position, Returns feeGrowthInside0LastX128 fee growth of token0 inside the tick range as of the last mint/burn/poke, Returns feeGrowthInside1LastX128 fee growth of token1 inside the tick range as of the last mint/burn/poke, Returns tokensOwed0 the computed amount of token0 owed to the position as of the last mint/burn/poke, Returns tokensOwed1 the computed amount of token1 owed to the position as of the last mint/burn/poke\"}},\"protocolFees()\":{\"details\":\"Protocol fees will never exceed uint128 max in either token\"},\"slot0()\":{\"returns\":{\"sqrtPriceX96\":\"The current price of the pool as a sqrt(token1/token0) Q64.96 value tick The current tick of the pool, i.e. according to the last tick transition that was run. This value may not always be equal to SqrtTickMath.getTickAtSqrtRatio(sqrtPriceX96) if the price is on a tick boundary. observationIndex The index of the last oracle observation that was written, observationCardinality The current maximum number of observations stored in the pool, observationCardinalityNext The next maximum number of observations, to be updated when the observation. feeProtocol The protocol fee for both tokens of the pool. Encoded as two 4 bit values, where the protocol fee of token1 is shifted 4 bits and the protocol fee of token0 is the lower 4 bits. Used as the denominator of a fraction of the swap fee, e.g. 4 means 1/4th of the swap fee. unlocked Whether the pool is currently locked to reentrancy\"}},\"ticks(int24)\":{\"params\":{\"tick\":\"The tick to look up\"},\"returns\":{\"liquidityGross\":\"the total amount of position liquidity that uses the pool either as tick lower or tick upper, liquidityNet how much liquidity changes when the pool price crosses the tick, feeGrowthOutside0X128 the fee growth on the other side of the tick from the current tick in token0, feeGrowthOutside1X128 the fee growth on the other side of the tick from the current tick in token1, tickCumulativeOutside the cumulative tick value on the other side of the tick from the current tick secondsPerLiquidityOutsideX128 the seconds spent per liquidity on the other side of the tick from the current tick, secondsOutside the seconds spent on the other side of the tick from the current tick, initialized Set to true if the tick is initialized, i.e. liquidityGross is greater than 0, otherwise equal to false. Outside values can only be used if the tick is initialized, i.e. if liquidityGross is greater than 0. In addition, these values are only relative and must be used only in comparison to previous snapshots for a specific position.\"}}},\"title\":\"Pool state that can change\",\"version\":1},\"userdoc\":{\"kind\":\"user\",\"methods\":{\"feeGrowthGlobal0X128()\":{\"notice\":\"The fee growth as a Q128.128 fees of token0 collected per unit of liquidity for the entire life of the pool\"},\"feeGrowthGlobal1X128()\":{\"notice\":\"The fee growth as a Q128.128 fees of token1 collected per unit of liquidity for the entire life of the pool\"},\"liquidity()\":{\"notice\":\"The currently in range liquidity available to the pool\"},\"observations(uint256)\":{\"notice\":\"Returns data about a specific observation index\"},\"positions(bytes32)\":{\"notice\":\"Returns the information about a position by the position's key\"},\"protocolFees()\":{\"notice\":\"The amounts of token0 and token1 that are owed to the protocol\"},\"slot0()\":{\"notice\":\"The 0th storage slot in the pool stores many values, and is exposed as a single method to save gas when accessed externally.\"},\"tickBitmap(int16)\":{\"notice\":\"Returns 256 packed tick initialized boolean values. See TickBitmap for more information\"},\"ticks(int24)\":{\"notice\":\"Look up information about a specific tick in the pool\"}},\"notice\":\"These methods compose the pool's state, and can change with any frequency including multiple times per transaction\",\"version\":1}},\"settings\":{\"compilationTarget\":{\"@uniswap/v3-core/contracts/interfaces/pool/IUniswapV3PoolState.sol\":\"IUniswapV3PoolState\"},\"evmVersion\":\"berlin\",\"libraries\":{},\"metadata\":{\"bytecodeHash\":\"ipfs\",\"useLiteralContent\":true},\"optimizer\":{\"enabled\":true,\"runs\":200},\"remappings\":[]},\"sources\":{\"@uniswap/v3-core/contracts/interfaces/pool/IUniswapV3PoolState.sol\":{\"content\":\"// SPDX-License-Identifier: GPL-2.0-or-later\\npragma solidity >=0.5.0;\\n\\n/// @title Pool state that can change\\n/// @notice These methods compose the pool's state, and can change with any frequency including multiple times\\n/// per transaction\\ninterface IUniswapV3PoolState {\\n    /// @notice The 0th storage slot in the pool stores many values, and is exposed as a single method to save gas\\n    /// when accessed externally.\\n    /// @return sqrtPriceX96 The current price of the pool as a sqrt(token1/token0) Q64.96 value\\n    /// tick The current tick of the pool, i.e. according to the last tick transition that was run.\\n    /// This value may not always be equal to SqrtTickMath.getTickAtSqrtRatio(sqrtPriceX96) if the price is on a tick\\n    /// boundary.\\n    /// observationIndex The index of the last oracle observation that was written,\\n    /// observationCardinality The current maximum number of observations stored in the pool,\\n    /// observationCardinalityNext The next maximum number of observations, to be updated when the observation.\\n    /// feeProtocol The protocol fee for both tokens of the pool.\\n    /// Encoded as two 4 bit values, where the protocol fee of token1 is shifted 4 bits and the protocol fee of token0\\n    /// is the lower 4 bits. Used as the denominator of a fraction of the swap fee, e.g. 4 means 1/4th of the swap fee.\\n    /// unlocked Whether the pool is currently locked to reentrancy\\n    function slot0()\\n        external\\n        view\\n        returns (\\n            uint160 sqrtPriceX96,\\n            int24 tick,\\n            uint16 observationIndex,\\n            uint16 observationCardinality,\\n            uint16 observationCardinalityNext,\\n            uint8 feeProtocol,\\n            bool unlocked\\n        );\\n\\n    /// @notice The fee growth as a Q128.128 fees of token0 collected per unit of liquidity for the entire life of the pool\\n    /// @dev This value can overflow the uint256\\n    function feeGrowthGlobal0X128() external view returns (uint256);\\n\\n    /// @notice The fee growth as a Q128.128 fees of token1 collected per unit of liquidity for the entire life of the pool\\n    /// @dev This value can overflow the uint256\\n    function feeGrowthGlobal1X128() external view returns (uint256);\\n\\n    /// @notice The amounts of token0 and token1 that are owed to the protocol\\n    /// @dev Protocol fees will never exceed uint128 max in either token\\n    function protocolFees() external view returns (uint128 token0, uint128 token1);\\n\\n    /// @notice The currently in range liquidity available to the pool\\n    /// @dev This value has no relationship to the total liquidity across all ticks\\n    function liquidity() external view returns (uint128);\\n\\n    /// @notice Look up information about a specific tick in the pool\\n    /// @param tick The tick to look up\\n    /// @return liquidityGross the total amount of position liquidity that uses the pool either as tick lower or\\n    /// tick upper,\\n    /// liquidityNet how much liquidity changes when the pool price crosses the tick,\\n    /// feeGrowthOutside0X128 the fee growth on the other side of the tick from the current tick in token0,\\n    /// feeGrowthOutside1X128 the fee growth on the other side of the tick from the current tick in token1,\\n    /// tickCumulativeOutside the cumulative tick value on the other side of the tick from the current tick\\n    /// secondsPerLiquidityOutsideX128 the seconds spent per liquidity on the other side of the tick from the current tick,\\n    /// secondsOutside the seconds spent on the other side of the tick from the current tick,\\n    /// initialized Set to true if the tick is initialized, i.e. liquidityGross is greater than 0, otherwise equal to false.\\n    /// Outside values can only be used if the tick is initialized, i.e. if liquidityGross is greater than 0.\\n    /// In addition, these values are only relative and must be used only in comparison to previous snapshots for\\n    /// a specific position.\\n    function ticks(int24 tick)\\n        external\\n        view\\n        returns (\\n            uint128 liquidityGross,\\n            int128 liquidityNet,\\n            uint256 feeGrowthOutside0X128,\\n            uint256 feeGrowthOutside1X128,\\n            int56 tickCumulativeOutside,\\n            uint160 secondsPerLiquidityOutsideX128,\\n            uint32 secondsOutside,\\n            bool initialized\\n        );\\n\\n    /// @notice Returns 256 packed tick initialized boolean values. See TickBitmap for more information\\n    function tickBitmap(int16 wordPosition) external view returns (uint256);\\n\\n    /// @notice Returns the information about a position by the position's key\\n    /// @param key The position's key is a hash of a preimage composed by the owner, tickLower and tickUpper\\n    /// @return _liquidity The amount of liquidity in the position,\\n    /// Returns feeGrowthInside0LastX128 fee growth of token0 inside the tick range as of the last mint/burn/poke,\\n    /// Returns feeGrowthInside1LastX128 fee growth of token1 inside the tick range as of the last mint/burn/poke,\\n    /// Returns tokensOwed0 the computed amount of token0 owed to the position as of the last mint/burn/poke,\\n    /// Returns tokensOwed1 the computed amount of token1 owed to the position as of the last mint/burn/poke\\n    function positions(bytes32 key)\\n        external\\n        view\\n        returns (\\n            uint128 _liquidity,\\n            uint256 feeGrowthInside0LastX128,\\n            uint256 feeGrowthInside1LastX128,\\n            uint128 tokensOwed0,\\n            uint128 tokensOwed1\\n        );\\n\\n    /// @notice Returns data about a specific observation index\\n    /// @param index The element of the observations array to fetch\\n    /// @dev You most likely want to use #observe() instead of this method to get an observation as of some amount of time\\n    /// ago, rather than at a specific index in the array.\\n    /// @return blockTimestamp The timestamp of the observation,\\n    /// Returns tickCumulative the tick multiplied by seconds elapsed for the life of the pool as of the observation timestamp,\\n    /// Returns secondsPerLiquidityCumulativeX128 the seconds per in range liquidity for the life of the pool as of the observation timestamp,\\n    /// Returns initialized whether the observation has been initialized and the values are safe to use\\n    function observations(uint256 index)\\n        external\\n        view\\n        returns (\\n            uint32 blockTimestamp,\\n            int56 tickCumulative,\\n            uint160 secondsPerLiquidityCumulativeX128,\\n            bool initialized\\n        );\\n}\\n\",\"keccak256\":\"0x852dc1f5df7dcf7f11e7bb3eed79f0cea72ad4b25f6a9d2c35aafb48925fd49f\",\"license\":\"GPL-2.0-or-later\"}},\"version\":1}",
  "storageLayout": {
    "storage": [],
    "types": null
  },
  "userdoc": {
    "kind": "user",
    "methods": {
      "feeGrowthGlobal0X128()": {
        "notice": "The fee growth as a Q128.128 fees of token0 collected per unit of liquidity for the entire life of the pool"
      },
      "feeGrowthGlobal1X128()": {
        "notice": "The fee growth as a Q128.128 fees of token1 collected per unit of liquidity for the entire life of the pool"
      },
      "liquidity()": {
        "notice": "The currently in range liquidity available to the pool"
      },
      "observations(uint256)": {
        "notice": "Returns data about a specific observation index"
      },
      "positions(bytes32)": {
        "notice": "Returns the information about a position by the position's key"
      },
      "protocolFees()": {
        "notice": "The amounts of token0 and token1 that are owed to the protocol"
      },
      "slot0()": {
        "notice": "The 0th storage slot in the pool stores many values, and is exposed as a single method to save gas when accessed externally."
      },
      "tickBitmap(int16)": {
        "notice": "Returns 256 packed tick initialized boolean values. See TickBitmap for more information"
      },
      "ticks(int24)": {
        "notice": "Look up information about a specific tick in the pool"
      }
    },
    "notice": "These methods compose the pool's state, and can change with any frequency including multiple times per transaction",
    "version": 1
  }
}