{
  "contractName": "StakingPoolStaking",
  "sourceName": "contracts/interfaces/StakingPoolStaking.sol",
  "abi": [
    {
      "inputs": [],
      "name": "amounts",
      "outputs": [
        {
          "internalType": "uint256",
          "name": "stake",
          "type": "uint256"
        },
        {
          "internalType": "uint256",
          "name": "unstake",
          "type": "uint256"
        },
        {
          "internalType": "uint256",
          "name": "withdraw",
          "type": "uint256"
        }
      ],
      "stateMutability": "view",
      "type": "function"
    },
    {
      "inputs": [],
      "name": "rebalance",
      "outputs": [],
      "stateMutability": "nonpayable",
      "type": "function"
    }
  ],
  "bytecode": "0x",
  "deployedBytecode": "0x",
  "linkReferences": {},
  "deployedLinkReferences": {},
  "devdoc": {
    "author": "Danilo Tuler",
    "kind": "dev",
    "methods": {
      "amounts()": {
        "returns": {
          "stake": "amount of tokens that can be staked",
          "unstake": "amount of tokens that must be unstaked to add liquidity",
          "withdraw": "amount of tokens that can be withdrawn to add liquidity"
        }
      }
    },
    "title": "Interaction between a pool and the staking contract",
    "version": 1
  },
  "evm": {
    "bytecode": {
      "functionDebugData": {},
      "generatedSources": [],
      "linkReferences": {},
      "object": "",
      "opcodes": "",
      "sourceMap": ""
    },
    "deployedBytecode": {
      "functionDebugData": {},
      "generatedSources": [],
      "immutableReferences": {},
      "linkReferences": {},
      "object": "",
      "opcodes": "",
      "sourceMap": ""
    },
    "gasEstimates": null,
    "methodIdentifiers": {
      "amounts()": "6beaeeae",
      "rebalance()": "7d7c2a1c"
    }
  },
  "metadata": "{\"compiler\":{\"version\":\"0.8.6+commit.11564f7e\"},\"language\":\"Solidity\",\"output\":{\"abi\":[{\"inputs\":[],\"name\":\"amounts\",\"outputs\":[{\"internalType\":\"uint256\",\"name\":\"stake\",\"type\":\"uint256\"},{\"internalType\":\"uint256\",\"name\":\"unstake\",\"type\":\"uint256\"},{\"internalType\":\"uint256\",\"name\":\"withdraw\",\"type\":\"uint256\"}],\"stateMutability\":\"view\",\"type\":\"function\"},{\"inputs\":[],\"name\":\"rebalance\",\"outputs\":[],\"stateMutability\":\"nonpayable\",\"type\":\"function\"}],\"devdoc\":{\"author\":\"Danilo Tuler\",\"kind\":\"dev\",\"methods\":{\"amounts()\":{\"returns\":{\"stake\":\"amount of tokens that can be staked\",\"unstake\":\"amount of tokens that must be unstaked to add liquidity\",\"withdraw\":\"amount of tokens that can be withdrawn to add liquidity\"}}},\"title\":\"Interaction between a pool and the staking contract\",\"version\":1},\"userdoc\":{\"kind\":\"user\",\"methods\":{\"amounts()\":{\"notice\":\"provide information for offchain about the amount for each staking operation on the main Staking contract\"},\"rebalance()\":{\"notice\":\"Move tokens from pool to staking or vice-versa, according to required liquidity. If the pool has more liquidity then necessary, it stakes tokens. If the pool has less liquidity then necessary, and has not started an unstake, it unstakes. If the pool has less liquity than necessary, and has started an unstake, it withdraws if possible.\"}},\"notice\":\"This interface models all interactions between a pool and the staking contract, including staking, unstaking and withdrawing. Tokens staked by pool users will stay at the pool until the pool owner decides to stake them in the staking contract. On the other hand, tokens unstaked by pool users are added to a required liquidity accumulator, and must be unstaked and withdrawn from the staking contract.\",\"version\":1}},\"settings\":{\"compilationTarget\":{\"contracts/interfaces/StakingPoolStaking.sol\":\"StakingPoolStaking\"},\"evmVersion\":\"berlin\",\"libraries\":{},\"metadata\":{\"bytecodeHash\":\"ipfs\",\"useLiteralContent\":true},\"optimizer\":{\"enabled\":true,\"runs\":200},\"remappings\":[]},\"sources\":{\"contracts/interfaces/StakingPoolStaking.sol\":{\"content\":\"// Copyright 2021 Cartesi Pte. Ltd.\\n\\n// SPDX-License-Identifier: Apache-2.0\\n// Licensed under the Apache License, Version 2.0 (the \\\"License\\\"); you may not use\\n// this file except in compliance with the License. You may obtain a copy of the\\n// License at http://www.apache.org/licenses/LICENSE-2.0\\n\\n// Unless required by applicable law or agreed to in writing, software distributed\\n// under the License is distributed on an \\\"AS IS\\\" BASIS, WITHOUT WARRANTIES OR\\n// CONDITIONS OF ANY KIND, either express or implied. See the License for the\\n// specific language governing permissions and limitations under the License.\\n\\npragma solidity >=0.7.0;\\n\\n/// @title Interaction between a pool and the staking contract\\n/// @author Danilo Tuler\\n/// @notice This interface models all interactions between a pool and the staking contract,\\n/// including staking, unstaking and withdrawing.\\n/// Tokens staked by pool users will stay at the pool until the pool owner decides to\\n/// stake them in the staking contract. On the other hand, tokens unstaked by pool users\\n/// are added to a required liquidity accumulator, and must be unstaked and withdrawn from\\n/// the staking contract.\\ninterface StakingPoolStaking {\\n    /// @notice Move tokens from pool to staking or vice-versa, according to required liquidity.\\n    /// If the pool has more liquidity then necessary, it stakes tokens.\\n    /// If the pool has less liquidity then necessary, and has not started an unstake, it unstakes.\\n    /// If the pool has less liquity than necessary, and has started an unstake, it withdraws if possible.\\n    function rebalance() external;\\n\\n    /// @notice provide information for offchain about the amount for each\\n    /// staking operation on the main Staking contract\\n    /// @return stake amount of tokens that can be staked\\n    /// @return unstake amount of tokens that must be unstaked to add liquidity\\n    /// @return withdraw amount of tokens that can be withdrawn to add liquidity\\n    function amounts()\\n        external\\n        view\\n        returns (\\n            uint256 stake,\\n            uint256 unstake,\\n            uint256 withdraw\\n        );\\n}\\n\",\"keccak256\":\"0xd79a4bbc8defea295205493352e73802c29a3478fe345b04885eef3cb82c3a25\",\"license\":\"Apache-2.0\"}},\"version\":1}",
  "storageLayout": {
    "storage": [],
    "types": null
  },
  "userdoc": {
    "kind": "user",
    "methods": {
      "amounts()": {
        "notice": "provide information for offchain about the amount for each staking operation on the main Staking contract"
      },
      "rebalance()": {
        "notice": "Move tokens from pool to staking or vice-versa, according to required liquidity. If the pool has more liquidity then necessary, it stakes tokens. If the pool has less liquidity then necessary, and has not started an unstake, it unstakes. If the pool has less liquity than necessary, and has started an unstake, it withdraws if possible."
      }
    },
    "notice": "This interface models all interactions between a pool and the staking contract, including staking, unstaking and withdrawing. Tokens staked by pool users will stay at the pool until the pool owner decides to stake them in the staking contract. On the other hand, tokens unstaked by pool users are added to a required liquidity accumulator, and must be unstaked and withdrawn from the staking contract.",
    "version": 1
  }
}