{
  "contractName": "StakingPoolWorker",
  "sourceName": "contracts/interfaces/StakingPoolWorker.sol",
  "abi": [
    {
      "inputs": [
        {
          "internalType": "address",
          "name": "workerAddress",
          "type": "address"
        }
      ],
      "name": "cancelHire",
      "outputs": [],
      "stateMutability": "nonpayable",
      "type": "function"
    },
    {
      "inputs": [
        {
          "internalType": "address payable",
          "name": "workerAddress",
          "type": "address"
        }
      ],
      "name": "hire",
      "outputs": [],
      "stateMutability": "payable",
      "type": "function"
    },
    {
      "inputs": [
        {
          "internalType": "address payable",
          "name": "workerAddress",
          "type": "address"
        }
      ],
      "name": "retire",
      "outputs": [],
      "stateMutability": "nonpayable",
      "type": "function"
    },
    {
      "inputs": [],
      "name": "selfhire",
      "outputs": [],
      "stateMutability": "payable",
      "type": "function"
    }
  ],
  "bytecode": "0x",
  "deployedBytecode": "0x",
  "linkReferences": {},
  "deployedLinkReferences": {},
  "devdoc": {
    "kind": "dev",
    "methods": {
      "cancelHire(address)": {
        "params": {
          "workerAddress": "address of the worker node"
        }
      },
      "hire(address)": {
        "params": {
          "workerAddress": "address of the worker"
        }
      },
      "retire(address)": {
        "details": "this also removes all authorizations in place",
        "params": {
          "workerAddress": "address of the worker to be retired"
        }
      }
    },
    "version": 1
  },
  "evm": {
    "bytecode": {
      "functionDebugData": {},
      "generatedSources": [],
      "linkReferences": {},
      "object": "",
      "opcodes": "",
      "sourceMap": ""
    },
    "deployedBytecode": {
      "functionDebugData": {},
      "generatedSources": [],
      "immutableReferences": {},
      "linkReferences": {},
      "object": "",
      "opcodes": "",
      "sourceMap": ""
    },
    "gasEstimates": null,
    "methodIdentifiers": {
      "cancelHire(address)": "b64b3bed",
      "hire(address)": "d9d6bd86",
      "retire(address)": "9e6371ba",
      "selfhire()": "6ff46a6c"
    }
  },
  "metadata": "{\"compiler\":{\"version\":\"0.8.7+commit.e28d00a7\"},\"language\":\"Solidity\",\"output\":{\"abi\":[{\"inputs\":[{\"internalType\":\"address\",\"name\":\"workerAddress\",\"type\":\"address\"}],\"name\":\"cancelHire\",\"outputs\":[],\"stateMutability\":\"nonpayable\",\"type\":\"function\"},{\"inputs\":[{\"internalType\":\"address payable\",\"name\":\"workerAddress\",\"type\":\"address\"}],\"name\":\"hire\",\"outputs\":[],\"stateMutability\":\"payable\",\"type\":\"function\"},{\"inputs\":[{\"internalType\":\"address payable\",\"name\":\"workerAddress\",\"type\":\"address\"}],\"name\":\"retire\",\"outputs\":[],\"stateMutability\":\"nonpayable\",\"type\":\"function\"},{\"inputs\":[],\"name\":\"selfhire\",\"outputs\":[],\"stateMutability\":\"payable\",\"type\":\"function\"}],\"devdoc\":{\"kind\":\"dev\",\"methods\":{\"cancelHire(address)\":{\"params\":{\"workerAddress\":\"address of the worker node\"}},\"hire(address)\":{\"params\":{\"workerAddress\":\"address of the worker\"}},\"retire(address)\":{\"details\":\"this also removes all authorizations in place\",\"params\":{\"workerAddress\":\"address of the worker to be retired\"}}},\"version\":1},\"userdoc\":{\"kind\":\"user\",\"methods\":{\"cancelHire(address)\":{\"notice\":\"Called by the user to cancel a job offer\"},\"hire(address)\":{\"notice\":\"Asks the worker to work for the sender. Sender needs to pay something.\"},\"retire(address)\":{\"notice\":\"Called by the user to retire his worker.\"},\"selfhire()\":{\"notice\":\"allows for the pool to act on its own behalf when producing blocks.\"}},\"version\":1}},\"settings\":{\"compilationTarget\":{\"contracts/interfaces/StakingPoolWorker.sol\":\"StakingPoolWorker\"},\"evmVersion\":\"london\",\"libraries\":{},\"metadata\":{\"bytecodeHash\":\"ipfs\",\"useLiteralContent\":true},\"optimizer\":{\"enabled\":true,\"runs\":200},\"remappings\":[]},\"sources\":{\"contracts/interfaces/StakingPoolWorker.sol\":{\"content\":\"// Copyright 2021 Cartesi Pte. Ltd.\\n\\n// SPDX-License-Identifier: Apache-2.0\\n// Licensed under the Apache License, Version 2.0 (the \\\"License\\\"); you may not use\\n// this file except in compliance with the License. You may obtain a copy of the\\n// License at http://www.apache.org/licenses/LICENSE-2.0\\n\\n// Unless required by applicable law or agreed to in writing, software distributed\\n// under the License is distributed on an \\\"AS IS\\\" BASIS, WITHOUT WARRANTIES OR\\n// CONDITIONS OF ANY KIND, either express or implied. See the License for the\\n// specific language governing permissions and limitations under the License.\\n\\npragma solidity >=0.7.0;\\n\\ninterface StakingPoolWorker {\\n    /// @notice allows for the pool to act on its own behalf when producing blocks.\\n    function selfhire() external payable;\\n\\n    /// @notice Asks the worker to work for the sender. Sender needs to pay something.\\n    /// @param workerAddress address of the worker\\n    function hire(address payable workerAddress) external payable;\\n\\n    /// @notice Called by the user to cancel a job offer\\n    /// @param workerAddress address of the worker node\\n    function cancelHire(address workerAddress) external;\\n\\n    /// @notice Called by the user to retire his worker.\\n    /// @param workerAddress address of the worker to be retired\\n    /// @dev this also removes all authorizations in place\\n    function retire(address payable workerAddress) external;\\n}\\n\",\"keccak256\":\"0x66b0366bc973b3dbc8591c1cd6e558ee5456192a31ee1262b8b5e855c30a9023\",\"license\":\"Apache-2.0\"}},\"version\":1}",
  "storageLayout": {
    "storage": [],
    "types": null
  },
  "userdoc": {
    "kind": "user",
    "methods": {
      "cancelHire(address)": {
        "notice": "Called by the user to cancel a job offer"
      },
      "hire(address)": {
        "notice": "Asks the worker to work for the sender. Sender needs to pay something."
      },
      "retire(address)": {
        "notice": "Called by the user to retire his worker."
      },
      "selfhire()": {
        "notice": "allows for the pool to act on its own behalf when producing blocks."
      }
    },
    "version": 1
  }
}