{
  "contractName": "StakingPoolManagement",
  "sourceName": "contracts/StakingPoolManagement.sol",
  "abi": [
    {
      "anonymous": false,
      "inputs": [
        {
          "indexed": false,
          "internalType": "string",
          "name": "name",
          "type": "string"
        }
      ],
      "name": "StakingPoolRenamed",
      "type": "event"
    },
    {
      "inputs": [
        {
          "internalType": "address",
          "name": "workerAddress",
          "type": "address"
        }
      ],
      "name": "cancelHire",
      "outputs": [],
      "stateMutability": "nonpayable",
      "type": "function"
    },
    {
      "inputs": [
        {
          "internalType": "address payable",
          "name": "workerAddress",
          "type": "address"
        }
      ],
      "name": "hire",
      "outputs": [],
      "stateMutability": "payable",
      "type": "function"
    },
    {
      "inputs": [],
      "name": "pause",
      "outputs": [],
      "stateMutability": "nonpayable",
      "type": "function"
    },
    {
      "inputs": [
        {
          "internalType": "address payable",
          "name": "workerAddress",
          "type": "address"
        }
      ],
      "name": "retire",
      "outputs": [],
      "stateMutability": "nonpayable",
      "type": "function"
    },
    {
      "inputs": [],
      "name": "selfhire",
      "outputs": [],
      "stateMutability": "payable",
      "type": "function"
    },
    {
      "inputs": [
        {
          "internalType": "string",
          "name": "name",
          "type": "string"
        }
      ],
      "name": "setName",
      "outputs": [],
      "stateMutability": "nonpayable",
      "type": "function"
    },
    {
      "inputs": [],
      "name": "unpause",
      "outputs": [],
      "stateMutability": "nonpayable",
      "type": "function"
    }
  ],
  "bytecode": "0x",
  "deployedBytecode": "0x",
  "linkReferences": {},
  "deployedLinkReferences": {},
  "devdoc": {
    "kind": "dev",
    "methods": {
      "cancelHire(address)": {
        "params": {
          "workerAddress": "address of the worker node"
        }
      },
      "hire(address)": {
        "params": {
          "workerAddress": "address of the worker"
        }
      },
      "retire(address)": {
        "details": "this also removes all authorizations in place",
        "params": {
          "workerAddress": "address of the worker to be retired"
        }
      }
    },
    "version": 1
  },
  "evm": {
    "bytecode": {
      "functionDebugData": {},
      "generatedSources": [],
      "linkReferences": {},
      "object": "",
      "opcodes": "",
      "sourceMap": ""
    },
    "deployedBytecode": {
      "functionDebugData": {},
      "generatedSources": [],
      "immutableReferences": {},
      "linkReferences": {},
      "object": "",
      "opcodes": "",
      "sourceMap": ""
    },
    "gasEstimates": null,
    "methodIdentifiers": {
      "cancelHire(address)": "b64b3bed",
      "hire(address)": "d9d6bd86",
      "pause()": "8456cb59",
      "retire(address)": "9e6371ba",
      "selfhire()": "6ff46a6c",
      "setName(string)": "c47f0027",
      "unpause()": "3f4ba83a"
    }
  },
  "metadata": "{\"compiler\":{\"version\":\"0.8.6+commit.11564f7e\"},\"language\":\"Solidity\",\"output\":{\"abi\":[{\"anonymous\":false,\"inputs\":[{\"indexed\":false,\"internalType\":\"string\",\"name\":\"name\",\"type\":\"string\"}],\"name\":\"StakingPoolRenamed\",\"type\":\"event\"},{\"inputs\":[{\"internalType\":\"address\",\"name\":\"workerAddress\",\"type\":\"address\"}],\"name\":\"cancelHire\",\"outputs\":[],\"stateMutability\":\"nonpayable\",\"type\":\"function\"},{\"inputs\":[{\"internalType\":\"address payable\",\"name\":\"workerAddress\",\"type\":\"address\"}],\"name\":\"hire\",\"outputs\":[],\"stateMutability\":\"payable\",\"type\":\"function\"},{\"inputs\":[],\"name\":\"pause\",\"outputs\":[],\"stateMutability\":\"nonpayable\",\"type\":\"function\"},{\"inputs\":[{\"internalType\":\"address payable\",\"name\":\"workerAddress\",\"type\":\"address\"}],\"name\":\"retire\",\"outputs\":[],\"stateMutability\":\"nonpayable\",\"type\":\"function\"},{\"inputs\":[],\"name\":\"selfhire\",\"outputs\":[],\"stateMutability\":\"payable\",\"type\":\"function\"},{\"inputs\":[{\"internalType\":\"string\",\"name\":\"name\",\"type\":\"string\"}],\"name\":\"setName\",\"outputs\":[],\"stateMutability\":\"nonpayable\",\"type\":\"function\"},{\"inputs\":[],\"name\":\"unpause\",\"outputs\":[],\"stateMutability\":\"nonpayable\",\"type\":\"function\"}],\"devdoc\":{\"kind\":\"dev\",\"methods\":{\"cancelHire(address)\":{\"params\":{\"workerAddress\":\"address of the worker node\"}},\"hire(address)\":{\"params\":{\"workerAddress\":\"address of the worker\"}},\"retire(address)\":{\"details\":\"this also removes all authorizations in place\",\"params\":{\"workerAddress\":\"address of the worker to be retired\"}}},\"version\":1},\"userdoc\":{\"events\":{\"StakingPoolRenamed(string)\":{\"notice\":\"Event emmited when a pool is rename\"}},\"kind\":\"user\",\"methods\":{\"cancelHire(address)\":{\"notice\":\"Called by the user to cancel a job offer\"},\"hire(address)\":{\"notice\":\"Asks the worker to work for the sender. Sender needs to pay something.\"},\"pause()\":{\"notice\":\"pauses new staking on the pool\"},\"retire(address)\":{\"notice\":\"Called by the user to retire his worker.\"},\"selfhire()\":{\"notice\":\"allows for the pool to act on its own behalf when producing blocks.\"},\"setName(string)\":{\"notice\":\"sets a name for the pool using ENS service\"},\"unpause()\":{\"notice\":\"unpauses new staking on the pool\"}},\"version\":1}},\"settings\":{\"compilationTarget\":{\"contracts/StakingPoolManagement.sol\":\"StakingPoolManagement\"},\"evmVersion\":\"berlin\",\"libraries\":{},\"metadata\":{\"bytecodeHash\":\"ipfs\",\"useLiteralContent\":true},\"optimizer\":{\"enabled\":true,\"runs\":200},\"remappings\":[]},\"sources\":{\"contracts/StakingPoolManagement.sol\":{\"content\":\"// Copyright 2021 Cartesi Pte. Ltd.\\n\\n// SPDX-License-Identifier: Apache-2.0\\n// Licensed under the Apache License, Version 2.0 (the \\\"License\\\"); you may not use\\n// this file except in compliance with the License. You may obtain a copy of the\\n// License at http://www.apache.org/licenses/LICENSE-2.0\\n\\n// Unless required by applicable law or agreed to in writing, software distributed\\n// under the License is distributed on an \\\"AS IS\\\" BASIS, WITHOUT WARRANTIES OR\\n// CONDITIONS OF ANY KIND, either express or implied. See the License for the\\n// specific language governing permissions and limitations under the License.\\n\\n/// @title Interface staking contract\\npragma solidity ^0.8.0;\\n\\ninterface StakingPoolManagement {\\n    /// @notice sets a name for the pool using ENS service\\n    function setName(string memory name) external;\\n\\n    /// @notice pauses new staking on the pool\\n    function pause() external;\\n\\n    /// @notice unpauses new staking on the pool\\n    function unpause() external;\\n\\n    /// @notice Event emmited when a pool is rename\\n    event StakingPoolRenamed(string name);\\n\\n    /// @notice allows for the pool to act on its own behalf when producing blocks.\\n    function selfhire() external payable;\\n\\n    /// @notice Asks the worker to work for the sender. Sender needs to pay something.\\n    /// @param workerAddress address of the worker\\n    function hire(address payable workerAddress) external payable;\\n\\n    /// @notice Called by the user to cancel a job offer\\n    /// @param workerAddress address of the worker node\\n    function cancelHire(address workerAddress) external;\\n\\n    /// @notice Called by the user to retire his worker.\\n    /// @param workerAddress address of the worker to be retired\\n    /// @dev this also removes all authorizations in place\\n    function retire(address payable workerAddress) external;\\n}\\n\",\"keccak256\":\"0xec0e9343c5cfbe93b7443e6786d8d1e7a6cfe8f57526afcb0e02ff426e8de02b\",\"license\":\"Apache-2.0\"}},\"version\":1}",
  "storageLayout": {
    "storage": [],
    "types": null
  },
  "userdoc": {
    "events": {
      "StakingPoolRenamed(string)": {
        "notice": "Event emmited when a pool is rename"
      }
    },
    "kind": "user",
    "methods": {
      "cancelHire(address)": {
        "notice": "Called by the user to cancel a job offer"
      },
      "hire(address)": {
        "notice": "Asks the worker to work for the sender. Sender needs to pay something."
      },
      "pause()": {
        "notice": "pauses new staking on the pool"
      },
      "retire(address)": {
        "notice": "Called by the user to retire his worker."
      },
      "selfhire()": {
        "notice": "allows for the pool to act on its own behalf when producing blocks."
      },
      "setName(string)": {
        "notice": "sets a name for the pool using ENS service"
      },
      "unpause()": {
        "notice": "unpauses new staking on the pool"
      }
    },
    "version": 1
  }
}