{
  "contractName": "StakingPoolFactory",
  "sourceName": "contracts/interfaces/StakingPoolFactory.sol",
  "abi": [
    {
      "anonymous": false,
      "inputs": [
        {
          "indexed": true,
          "internalType": "address",
          "name": "pool",
          "type": "address"
        },
        {
          "indexed": false,
          "internalType": "address",
          "name": "fee",
          "type": "address"
        }
      ],
      "name": "NewFlatRateCommissionStakingPool",
      "type": "event"
    },
    {
      "anonymous": false,
      "inputs": [
        {
          "indexed": true,
          "internalType": "address",
          "name": "pool",
          "type": "address"
        },
        {
          "indexed": false,
          "internalType": "address",
          "name": "fee",
          "type": "address"
        }
      ],
      "name": "NewGasTaxCommissionStakingPool",
      "type": "event"
    },
    {
      "inputs": [
        {
          "internalType": "uint256",
          "name": "commission",
          "type": "uint256"
        }
      ],
      "name": "createFlatRateCommission",
      "outputs": [
        {
          "internalType": "address",
          "name": "",
          "type": "address"
        }
      ],
      "stateMutability": "payable",
      "type": "function"
    },
    {
      "inputs": [
        {
          "internalType": "uint256",
          "name": "gas",
          "type": "uint256"
        }
      ],
      "name": "createGasTaxCommission",
      "outputs": [
        {
          "internalType": "address",
          "name": "",
          "type": "address"
        }
      ],
      "stateMutability": "payable",
      "type": "function"
    },
    {
      "inputs": [],
      "name": "getPoS",
      "outputs": [
        {
          "internalType": "address",
          "name": "_pos",
          "type": "address"
        }
      ],
      "stateMutability": "view",
      "type": "function"
    }
  ],
  "bytecode": "0x",
  "deployedBytecode": "0x",
  "linkReferences": {},
  "deployedLinkReferences": {},
  "devdoc": {
    "events": {
      "NewFlatRateCommissionStakingPool(address,address)": {
        "params": {
          "fee": "address of the commission contract",
          "pool": "address of the new pool"
        }
      },
      "NewGasTaxCommissionStakingPool(address,address)": {
        "params": {
          "fee": "address of thhe commission contract",
          "pool": "address of the new pool"
        }
      }
    },
    "kind": "dev",
    "methods": {
      "createFlatRateCommission(uint256)": {
        "returns": {
          "_0": "new pool address"
        }
      },
      "createGasTaxCommission(uint256)": {
        "returns": {
          "_0": "new pool address"
        }
      },
      "getPoS()": {
        "returns": {
          "_pos": "address for the PoS contract"
        }
      }
    },
    "version": 1
  },
  "evm": {
    "bytecode": {
      "functionDebugData": {},
      "generatedSources": [],
      "linkReferences": {},
      "object": "",
      "opcodes": "",
      "sourceMap": ""
    },
    "deployedBytecode": {
      "functionDebugData": {},
      "generatedSources": [],
      "immutableReferences": {},
      "linkReferences": {},
      "object": "",
      "opcodes": "",
      "sourceMap": ""
    },
    "gasEstimates": null,
    "methodIdentifiers": {
      "createFlatRateCommission(uint256)": "86f1a717",
      "createGasTaxCommission(uint256)": "964658b6",
      "getPoS()": "2686e29d"
    }
  },
  "metadata": "{\"compiler\":{\"version\":\"0.8.7+commit.e28d00a7\"},\"language\":\"Solidity\",\"output\":{\"abi\":[{\"anonymous\":false,\"inputs\":[{\"indexed\":true,\"internalType\":\"address\",\"name\":\"pool\",\"type\":\"address\"},{\"indexed\":false,\"internalType\":\"address\",\"name\":\"fee\",\"type\":\"address\"}],\"name\":\"NewFlatRateCommissionStakingPool\",\"type\":\"event\"},{\"anonymous\":false,\"inputs\":[{\"indexed\":true,\"internalType\":\"address\",\"name\":\"pool\",\"type\":\"address\"},{\"indexed\":false,\"internalType\":\"address\",\"name\":\"fee\",\"type\":\"address\"}],\"name\":\"NewGasTaxCommissionStakingPool\",\"type\":\"event\"},{\"inputs\":[{\"internalType\":\"uint256\",\"name\":\"commission\",\"type\":\"uint256\"}],\"name\":\"createFlatRateCommission\",\"outputs\":[{\"internalType\":\"address\",\"name\":\"\",\"type\":\"address\"}],\"stateMutability\":\"payable\",\"type\":\"function\"},{\"inputs\":[{\"internalType\":\"uint256\",\"name\":\"gas\",\"type\":\"uint256\"}],\"name\":\"createGasTaxCommission\",\"outputs\":[{\"internalType\":\"address\",\"name\":\"\",\"type\":\"address\"}],\"stateMutability\":\"payable\",\"type\":\"function\"},{\"inputs\":[],\"name\":\"getPoS\",\"outputs\":[{\"internalType\":\"address\",\"name\":\"_pos\",\"type\":\"address\"}],\"stateMutability\":\"view\",\"type\":\"function\"}],\"devdoc\":{\"events\":{\"NewFlatRateCommissionStakingPool(address,address)\":{\"params\":{\"fee\":\"address of the commission contract\",\"pool\":\"address of the new pool\"}},\"NewGasTaxCommissionStakingPool(address,address)\":{\"params\":{\"fee\":\"address of thhe commission contract\",\"pool\":\"address of the new pool\"}}},\"kind\":\"dev\",\"methods\":{\"createFlatRateCommission(uint256)\":{\"returns\":{\"_0\":\"new pool address\"}},\"createGasTaxCommission(uint256)\":{\"returns\":{\"_0\":\"new pool address\"}},\"getPoS()\":{\"returns\":{\"_pos\":\"address for the PoS contract\"}}},\"version\":1},\"userdoc\":{\"events\":{\"NewFlatRateCommissionStakingPool(address,address)\":{\"notice\":\"Event emmited when a pool is created\"},\"NewGasTaxCommissionStakingPool(address,address)\":{\"notice\":\"Event emmited when a pool is created\"}},\"kind\":\"user\",\"methods\":{\"createFlatRateCommission(uint256)\":{\"notice\":\"Creates a new staking pool using a flat commission model emits NewFlatRateCommissionStakingPool with the parameters of the new pool\"},\"createGasTaxCommission(uint256)\":{\"notice\":\"Creates a new staking pool using a gas tax commission model emits NewGasTaxCommissionStakingPool with the parameters of the new pool\"},\"getPoS()\":{\"notice\":\"Returns configuration for the working pools of the current version\"}},\"version\":1}},\"settings\":{\"compilationTarget\":{\"contracts/interfaces/StakingPoolFactory.sol\":\"StakingPoolFactory\"},\"evmVersion\":\"london\",\"libraries\":{},\"metadata\":{\"bytecodeHash\":\"ipfs\",\"useLiteralContent\":true},\"optimizer\":{\"enabled\":true,\"runs\":200},\"remappings\":[]},\"sources\":{\"contracts/interfaces/StakingPoolFactory.sol\":{\"content\":\"// Copyright 2021 Cartesi Pte. Ltd.\\n\\n// SPDX-License-Identifier: Apache-2.0\\n// Licensed under the Apache License, Version 2.0 (the \\\"License\\\"); you may not use\\n// this file except in compliance with the License. You may obtain a copy of the\\n// License at http://www.apache.org/licenses/LICENSE-2.0\\n\\n// Unless required by applicable law or agreed to in writing, software distributed\\n// under the License is distributed on an \\\"AS IS\\\" BASIS, WITHOUT WARRANTIES OR\\n// CONDITIONS OF ANY KIND, either express or implied. See the License for the\\n// specific language governing permissions and limitations under the License.\\n\\npragma solidity >=0.7.0;\\n\\ninterface StakingPoolFactory {\\n    /// @notice Creates a new staking pool using a flat commission model\\n    /// emits NewFlatRateCommissionStakingPool with the parameters of the new pool\\n    /// @return new pool address\\n    function createFlatRateCommission(uint256 commission)\\n        external\\n        payable\\n        returns (address);\\n\\n    /// @notice Creates a new staking pool using a gas tax commission model\\n    /// emits NewGasTaxCommissionStakingPool with the parameters of the new pool\\n    /// @return new pool address\\n    function createGasTaxCommission(uint256 gas)\\n        external\\n        payable\\n        returns (address);\\n\\n    /// @notice Returns configuration for the working pools of the current version\\n    /// @return _pos address for the PoS contract\\n    function getPoS() external view returns (address _pos);\\n\\n    /// @notice Event emmited when a pool is created\\n    /// @param pool address of the new pool\\n    /// @param fee address of the commission contract\\n    event NewFlatRateCommissionStakingPool(address indexed pool, address fee);\\n\\n    /// @notice Event emmited when a pool is created\\n    /// @param pool address of the new pool\\n    /// @param fee address of thhe commission contract\\n    event NewGasTaxCommissionStakingPool(address indexed pool, address fee);\\n}\\n\",\"keccak256\":\"0x5e35f11721eee583e20da68db531eefd391300d6c14a757ccf42a5c189929a7a\",\"license\":\"Apache-2.0\"}},\"version\":1}",
  "storageLayout": {
    "storage": [],
    "types": null
  },
  "userdoc": {
    "events": {
      "NewFlatRateCommissionStakingPool(address,address)": {
        "notice": "Event emmited when a pool is created"
      },
      "NewGasTaxCommissionStakingPool(address,address)": {
        "notice": "Event emmited when a pool is created"
      }
    },
    "kind": "user",
    "methods": {
      "createFlatRateCommission(uint256)": {
        "notice": "Creates a new staking pool using a flat commission model emits NewFlatRateCommissionStakingPool with the parameters of the new pool"
      },
      "createGasTaxCommission(uint256)": {
        "notice": "Creates a new staking pool using a gas tax commission model emits NewGasTaxCommissionStakingPool with the parameters of the new pool"
      },
      "getPoS()": {
        "notice": "Returns configuration for the working pools of the current version"
      }
    },
    "version": 1
  }
}